id,title,authors,venue,paper year
r855,Addressing techniques used in database object managers O2 and ORION,"André Gamache, Nadjiba Sahraoui",ACM SIGMOD Record,1995
r856,An axiomatic model of dynamic schema evolution in objectbase systems,"Randel J. Peters, M. Tamer Özsu",ACM Transactions on Database Systems (TODS),1997
r857,An array-based algorithm for simultaneous multidimensional aggregates,"Yihong Zhao, Prasad M. Deshpande, Jeffrey F. Naughton",International Conference on Management of Data,1998
r858,Using Probabilistic Information in Data Integration,"Daniela Florescu, Daphne Koller, Alon Y. Levy",Very Large Data Bases,1997
r859,The intrinsic problems of structural heterogeneity and an approach to their solution,"Theo Härder, Günter Sauter, Joachim Thomas",The VLDB Journal — The International Journal on Very Large Data Bases,1999
r860,Association rules over interval data,"R. J. Miller, Y. Yang",International Conference on Management of Data,1997
r861,Statistical synopses for graph-structured XML databases,"Neoklis Polyzotis, Minos Garofalakis",International Conference on Management of Data,2002
r862,Independence is good: dependency-based histogram synopses for high-dimensional data,"Amol Deshpande, Minos Garofalakis, Rajeev Rastogi",International Conference on Management of Data,2001
r863,Disseminating Updates on Broadcast Disks,"Swarup Acharya, Michael J. Franklin, Stanley B. Zdonik",Very Large Data Bases,1996
r864,Databases on the Web: technologies for federation architectures and case studies,Ralf Kramer,International Conference on Management of Data,1997
r865,SQLEM: fast clustering in SQL using the EM algorithm,"Carlos Ordonez, Paul Cereghini",International Conference on Management of Data,2000
r866,T2: a customizable parallel database for multi-dimensional data,"Chialin Chang, Anurag Acharya, Alan Sussman, Joel Saltz",ACM SIGMOD Record,1998
r867,Specification and implementation of exceptions in workflow management systems,"Fabio Casati, Stefano Ceri, Stefano Paraboschi, Guiseppe Pozzi",ACM Transactions on Database Systems (TODS),1999
r868,Integrating SQL Databases with Content-Specific Search Engines,"Stefan Deßloch, Nelson Mendonça Mattos",Very Large Data Bases,1997
r869,The X-tree: An Index Structure for High-Dimensional Data,"Stefan Berchtold, Daniel A. Keim, Hans-Peter Kriegel",Very Large Data Bases,1996
r870,Checkpointing in Oracle,"Ashok Joshi, William Bridge, Juan Loaiza, Tirthankar Lahiri",Very Large Data Bases,1998
r871,AJAX: an extensible data cleaning tool,"Helena Galhardas, Daniela Florescu, Dennis Shasha, Eric Simon",International Conference on Management of Data,2000
r872,Bit-sliced index arithmetic,"Denis Rinfret, Patrick O'Neil, Elizabeth O'Neil",International Conference on Management of Data,2001
r873,Low-Cost Compensation-Based Query Processing,"Øystein Grøvlen, Svein-Olaf Hvasshovd, Øystein Torbjørnsen",Very Large Data Bases,1998
r874,Plan-Per-Tuple Optimization Solution - Parallel Execution of Expensive User-Defined Functions,"Felipe Cariño, William O'Connell",Very Large Data Bases,1998
r875,General match: a subsequence matching method in time-series databases based on generalized windows,"Yang-Sae Moon, Kyu-Young Whang, Wook-Shin Han",International Conference on Management of Data,2001
r876,Cache invalidation scheme for mobile computing systems with real-time data,"Joe Chun-Hung Yuen, Edward Chan, Kam-Yiu Lam, H. W. Leung",ACM SIGMOD Record,2000
r877,Special issue on data mining for intrusion detection and threat analysis,Daniel Barbará,ACM SIGMOD Record,2000
r878,Oracle media server: providing consumer based interactive access to multimedia data,"Andrew Laursen, Jeffrey Olkin, Mark Porter",International Conference on Management of Data,1994
r879,Operating System Extensions for the Teradata Parallel VLDB,"John Catozzi, Sorana Rabinovici",Very Large Data Bases,2001
r880,The OASIS multidatabase prototype,"Mark Roantree, John Murphy, Wilhelm Hasselbring",ACM SIGMOD Record,1999
r881,HMAP- A temporal data model managing intervals with different granularities and indeterminacy from natural language sentences,"Carlo Combi, Giuseppe Pozzi",The VLDB Journal — The International Journal on Very Large Data Bases,2001
r882,Ariadne: a system for constructing mediators for Internet sources,"José Luis Ambite, Naveen Ashish, Greg Barish, Craig A. Knoblock, Steven Minton, Pragnesh J. Modi, Ion Muslea, Andrew Philpot, Sheila Tejada",International Conference on Management of Data,1998
r883,Estimating the Selectivity of XML Path Expressions for Internet Scale Applications,"Ashraf Aboulnaga, Alaa R. Alameldeen, Jeffrey F. Naughton",Very Large Data Bases,2001
r884,Update propagation protocols for replicated databates,"Yuri Breitbart, Raghavan Komondoor, Rajeev Rastogi, S. Seshadri, Avi Silberschatz",International Conference on Management of Data,1999
r885,Report from the NSF workshop on workflow and process automation in information systems,"Amit Sheth, Dimitrios Georgakopoulos, Stef M. M. Joosten, Marek Rusinkiewicz, Walt Scacchi, Jack Wileden, Alexander L. Wolf",ACM SIGMOD Record,1996
r886,High-Performance Extensible Indexing,Marcel Kornacker,Very Large Data Bases,1999
r887,Are the terms version and variant orthogonal to one another?,Hartmut Wedekind,ACM SIGMOD Record,1995
r888,Aggregate-Query Processing in Data Warehousing Environments,"Ashish Gupta, Venky Harinarayan, Dallan Quass",Very Large Data Bases,1995
r889,INSITE: A Tool for Interpreting Users? Interaction with a Web Space,"Cyrus Shahabi, Adil Faisal, Farnoush Banaei Kashani, Jabed Faruque",Very Large Data Bases,2000
r890,Active rules for XML: A new paradigm for E-services,"Angela Bonifati, Stefano Ceri, Stefano Paraboschi",The VLDB Journal — The International Journal on Very Large Data Bases,2001
r891,Warping indexes with envelope transforms for query by humming,"Yunyue Zhu, Dennis Shasha",International Conference on Management of Data,2003
r892,SQL/XML is making good progress,"Andrew Eisenberg, Jim Melton",ACM SIGMOD Record,2002
r893,SPIRE: a progressive content-based spatial image retrieval engine,"Chung-Sheng Li, Lawrence D. Bergman, Yuan-Chi Chang, Vittorio Castelli, John R. Smith",International Conference on Management of Data,2000
r894,Distance-based indexing for high-dimensional metric spaces,"Tolga Bozkaya, Meral Ozsoyoglu",International Conference on Management of Data,1997
r895,"Probabilistic temporal databases, I: algebra","Alex Dekhtyar, Robert Ross, V. S. Subrahmanian",ACM Transactions on Database Systems (TODS),2001
r896,Synchronizing a database to improve freshness,"Junghoo Cho, Hector Garcia-Molina",International Conference on Management of Data,2000
r897,XML-based information mediation with MIX,"Chaitan Baru, Amarnath Gupta, Bertram Ludäscher, Richard Marciano, Yannis Papakonstantinou, Pavel Velikhov, Vincent Chu",International Conference on Management of Data,1999
r898,Discovery of Multiple-Level Association Rules from Large Databases,"Jiawei Han, Yongjian Fu",Very Large Data Bases,1995
r899,Including Group-By in Query Optimization,"Surajit Chaudhuri, Kyuseok Shim",Very Large Data Bases,1994
r900,Enabling End-users to Construct Data-intensive Web-sites from XML Repositories: An Example-based Approach,"Atsuyuki Morishima, Seiichi Koizumi, Hiroyuki Kitagawa, Satoshi Takano",Very Large Data Bases,2001
r901,Evolvable view environment (EVE): non-equivalent view maintenance under schema changes,"E. A. Rundensteiner, A. Koeller, X. Zhang, A. J. Lee, A. Nica, A. Van Wyk, Y. Lee",International Conference on Management of Data,1999
r902,"Mining the world wide web: an information search approach by George Chang, Marcus J. Healey (editor), James A. M. McHugh, Jason T. L. Wang",Aris Ouksel,ACM SIGMOD Record,2002
r903,"TPC-D-the challenges, issues and results",Ramesh Bhashyam,ACM SIGMOD Record,1996
r904,Converting relational to object-oriented databases,Joseph Fong,ACM SIGMOD Record,1997
r905,Wireless client/server computing for personal information services and applications,"Ahmed Elmagarmid, Jin Jing, Tetsuya Furukawa",ACM SIGMOD Record,1994
r906,Distributed top-k monitoring,"Brian Babcock, Chris Olston",International Conference on Management of Data,2003
r907,Safely and Efficiently Updating References During On-line Reorganization,"Chendong Zou, Betty Salzberg",Very Large Data Bases,1998
r908,Implementation of Two Semantic Query Optimization Techniques in DB2 Universal Database,"Qi Cheng, Jarek Gryz, Fred Koo, T. Y. Cliff Leung, Linqi Liu, Xiaoyan Qian, K. Bernhard Schiefer",Very Large Data Bases,1999
r909,Experiences in mining aviation safety data,"Zohreh Nazeri, Eric Bloedorn, Paul Ostwald",International Conference on Management of Data,2001
r910,"Honey, I shrunk the database: footprint, mobility, and beyond",Praveen Seshadri,International Conference on Management of Data,1999
r911,LockX: a system for efficiently querying secure XML,"SungRan Cho, Sihem Amer-Yahia, Laks V. S. Lakshmanan, Divesh Srivastava",International Conference on Management of Data,2003
r912,Metadata for mixed-media access,"Francine Chen, Marti Hearst, Julian Kupiec, Jan Pedersen, Lynn Wilcox",ACM SIGMOD Record,1994
r913,"Scalable feature selection, classification and signature generation for organizing large text databases into hierarchical topic taxonomies","Soumen Chakrabarti, Byron Dom, Rakesh Agrawal, Prabhakar Raghavan",The VLDB Journal — The International Journal on Very Large Data Bases,1999
r914,A template model for multidimensional inter-transactional association rules,"Ling Feng, Jeffrey Xu Yu, Hongjun Lu, Jiawei Han",The VLDB Journal — The International Journal on Very Large Data Bases,2002
r915,REVIEW: a real-time virtual walkthrough system,"L. Shou, C. H. Chionh, Z. Huang, Y. Ruan, Kian-Lee Tan",International Conference on Management of Data,2001
r916,The aditi deductive database system,"Jayen Vaghani, Kotagiri Ramamohanarao, David B. Kemp, Zoltan Somogyi, Peter J. Stuckey, Tim S. Leask, James Harland",The VLDB Journal — The International Journal on Very Large Data Bases,1994
r917,Storage Estimation for Multidimensional Aggregates in the Presence of Hierarchies,"Amit Shukla, Prasad Deshpande, Jeffrey F. Naughton, Karthikeyan Ramasamy",Very Large Data Bases,1996
r918,Optimizing object queries using an effective calculus,"Leonidas Fegaras, David Maier",ACM Transactions on Database Systems (TODS),2000
r919,A Database Index to Large Biological Sequences,"Ela Hunt, Malcolm P. Atkinson, Robert W. Irving",Very Large Data Bases,2001
r920,A comparison of selectivity estimators for range queries on metric attributes,"Björn Blohsfeld, Dieter Korus, Bernhard Seeger",International Conference on Management of Data,1999
r921,Reminiscences on influential papers,Richard Snodgrass,ACM SIGMOD Record,1998
r922,Rainbow: Distributed Database System for Classroom Education and Experimental Research,"Abdelsalam Helal, Hua Li",Very Large Data Bases,2000
r923,Workflow history management,"Pinar Koksal, Sena Nural Arpinar, Asuman Dogac",ACM SIGMOD Record,1998
r924,Cost-based optimization for magic: algebra and implementation,"Praveen Seshadri, Joseph M. Hellerstein, Hamid Pirahesh, T. Y. Cliff Leung, Raghu Ramakrishnan, Divesh Srivastava, Peter J. Stuckey, S. Sudarshan",International Conference on Management of Data,1996
r925,Virtual database technology,"Ashish Gupta, Venky Harinarayan, Anand Rajaraman",ACM SIGMOD Record,1997
r926,The Montage extensible DataBlade architecture,Michael Ubell,International Conference on Management of Data,1994
r927,Join algorithm costs revisited,"Evan P. Harris, Kotagiri Ramamohanarao",The VLDB Journal — The International Journal on Very Large Data Bases,1995
r928,Approximate XML joins,"Sudipto Guha, H. V. Jagadish, Nick Koudas, Divesh Srivastava, Ting Yu",International Conference on Management of Data,2002
r929,Database design with common sense business reasoning and learning,"Veda C. Storey, Roger H. L. Chiang, Debabrata Dey, Robert C. Goldstein, Shankar Sudaresan",ACM Transactions on Database Systems (TODS),1997
r930,Fast joins using join indices,"Zhe Li, Kenneth A. Ross",The VLDB Journal — The International Journal on Very Large Data Bases,1999
r931,Active Views for Electronic Commerce,"Serge Abiteboul, Bernd Amann, Sophie Cluet, Adi Eyal, Laurent Mignet, Tova Milo",Very Large Data Bases,1999
r932,A Database Platform for Bioinformatics,Sandeepan Banerjee,Very Large Data Bases,2000
r933,XML schema,"Charles E. Campbell, Andrew Eisenberg, Jim Melton",ACM SIGMOD Record,2003
r934,Agent-based semantic interoperability in infosleuth,"Jerry Fowler, Brad Perry, Marian Nodine, Bruce Bargmeyer",ACM SIGMOD Record,1999
r935,A data mining application: customer retention at the Port of Singapore Authority (PSA),"KianSing Ng, Huan Liu, HweeBong Kwah",International Conference on Management of Data,1998
r936,Evaluation of remote backup algorithms for transaction-processing systems,"Christos A. Polyzois, Héctor García-Molina",ACM Transactions on Database Systems (TODS),1994
r937,Maintenance of data cubes and summary tables in a warehouse,"Inderpal Singh Mumick, Dallan Quass, Barinderpal Singh Mumick",International Conference on Management of Data,1997
r938,Going public: open-source databases and database research,Philippe Bonnet,International Conference on Management of Data,2002
r939,Efficient concurrency control for broadcast environments,"Jayavel Shanmugasundaram, Arvind Nithrakashyap, Rajendran Sivasankaran, Krithi Ramamritham",International Conference on Management of Data,1999
r940,Collaborative Analytical Processing - Dream or Reality? (Panel abstract),"William O'Connell, Andrew Witkowski, Goetz Graefe",Very Large Data Bases,2001
r941,The PointCast network (abstract),"Satish Ramakrishnan, Vibha Dayal",International Conference on Management of Data,1998
r942,Reminiscences on influential papers,"Kenneth A. Ross, Theodore Johnson, Richard Thomas Snodgrass",ACM SIGMOD Record,2002
r943,Declarative updates of relational databases,Weidong Chen,ACM Transactions on Database Systems (TODS),1995
r944,ADEPT: an agent-based approach to business process management,"N. R. Jennings, T. J. Norman, P. Faratin",ACM SIGMOD Record,1998
r945,The Cubetree Storage Organization,"Nick Roussopoulos, Yannis Kotidis",Very Large Data Bases,1998
r946,Fast Computation of Sparse Datacubes,"Kenneth A. Ross, Divesh Srivastava",Very Large Data Bases,1997
r947,ObjectGlobe: Ubiquitous query processing on the Internet,"R. Braumandl, M. Keidl, A. Kemper, D. Kossmann, A. Kreutz, S. Seltzsam, K. Stocker",The VLDB Journal — The International Journal on Very Large Data Bases,2001
r948,Quickly generating billion-record synthetic databases,"Jim Gray, Prakash Sundaresan, Susanne Englert, Ken Baclawski, Peter J. Weinberger",International Conference on Management of Data,1994
r949,Metrics for Accessing Heterogeneous Data: Is There Any Hope? (Panel),"Leonard J. Seligman, Nicholas J. Belkin, Erich J. Neuhold, Michael Stonebraker, Gio Wiederhold",Very Large Data Bases,1995
r950,Optimization Algorithms for Exploiting the Parallelism-Communication Tradeoff in Pipelined Parallelism,"Waqar Hasan, Rajeev Motwani",Very Large Data Bases,1994
r951,Adaptive filters for continuous queries over distributed data streams,"Chris Olston, Jing Jiang, Jennifer Widom",International Conference on Management of Data,2003
r952,nD-SQL: A Multi-Dimensional Language for Interoperability and OLAP,"Frédéric Gingras, Laks V. S. Lakshmanan",Very Large Data Bases,1998
r953,Critical Database Technologies for High Energy Physics,"David M. Malon, Edward N. May",Very Large Data Bases,1996
r954,Qualitative representation of spatial knowledge in two-dimensional space,"Dimitris Papadias, Timos Sellis",The VLDB Journal — The International Journal on Very Large Data Bases,1994
r955,Pixel-oriented database visualizations,Daniel A. Keim,ACM SIGMOD Record,1996
r956,A scalable hash ripple join algorithm,"Gang Luo, Curt J. Ellmann, Peter J. Haas, Jeffrey F. Naughton",International Conference on Management of Data,2001
r957,Similarity Search for Adaptive Ellipsoid Queries Using Spatial Transformation,"Yasushi Sakurai, Masatoshi Yoshikawa, Ryoji Kataoka, Shunsuke Uemura",Very Large Data Bases,2001
r958,Report on the second IEEE metadata conference (Metadata '97),"Ron Musick, Chris Miller",ACM SIGMOD Record,1998
r959,Bluetooth-based sensor networks,"Philippe Bonnet, Allan Beaufour, Mads Bondo Dydensborg, Martin Leopold",ACM SIGMOD Record,2003
r960,A framework for expressing and combining preferences,"Rakesh Agrawal, Edward L. Wimmers",International Conference on Management of Data,2000
r961,Supply chain infrastructures: system integration and information sharing,"Michael O. Ball, Meng Ma, Louiqa Raschid, Zhengying Zhao",ACM SIGMOD Record,2002
r962,VQBD: exploring semistructured data,"Sudarshan S. Chawathe, Thomas Baby, Jihwang Yoo",International Conference on Management of Data,2001
r963,Analysis of SIGMOD's co-authorship graph,"Mario A. Nascimento, Jörg Sander, Jeffrey Pound",ACM SIGMOD Record,2003
r964,LDAP directory services- just another database application? (tutorial session),"Shridhar Shukla, Anand Deshpande",International Conference on Management of Data,2000
r965,Synthesis of extended transaction models using ACTA,"Panos K. Chrysanthis, Krithi Ramamritham",ACM Transactions on Database Systems (TODS),1994
r966,EROC: A Toolkit for Building NEATO Query Optimizers,"William J. McKenna, Louis Burger, Chi Hoang, Melissa Truong",Very Large Data Bases,1996
r967,"Report on the first international conference on ontologies, databases and applications of semantics (ODBASE): part of the federated conference On the Move to Meaningful Internet Systems 2002",Karl Aberer,ACM SIGMOD Record,2003
r968,Enhanced nearest neighbour search on the R-tree,"King Lum Cheung, Ada Wai-Chee Fu",ACM SIGMOD Record,2000
r969,A chase too far?,"Lucian Popa, Alin Deutsch, Arnaud Sahuguet, Val Tannen",International Conference on Management of Data,2000
r970,CheeTah: a Lightweight Transaction Server for Plug-and-Play Internet Data Management,"Guy Pardon, Gustavo Alonso",Very Large Data Bases,2000
r971,Structured document storage and refined declarative and navigational access mechanisms in HyperStorM,"Klemens Böhm, Karl Aberer, Erich J. Neuhold, Xiaoya Yang",The VLDB Journal — The International Journal on Very Large Data Bases,1997
r972,Providing database-like access to the Web using queries based on textual similarity,William W. Cohen,International Conference on Management of Data,1998
r973,The database group at University of Hagen,"Gunter Schlageter, Thomas Berkel, Eberhard Heuel, Silke Mittrach, Andreas Scherer, Wolfgang Wilkes",ACM SIGMOD Record,1995
r974,"The sensor spectrum: technology, trends, and requirements","Joseph M. Hellerstein, Wei Hong, Samuel R. Madden",ACM SIGMOD Record,2003
r975,Automatic generation of production rules for integrity maintenance,"Stefano Ceri, Piero Fraternali, Stefano Paraboschi, Letizia Tanca",ACM Transactions on Database Systems (TODS),1994
r976,A modified random perturbation method for database security,"Patrick Tendick, Norman Matloff",ACM Transactions on Database Systems (TODS),1994
r977,The design and performance evaluation of alternative XML storage strategies,"Feng Tian, David J. DeWitt, Jianjun Chen, Chun Zhang",ACM SIGMOD Record,2002
r978,Adaptive precision setting for cached approximate values,"Chris Olston, Boon Thau Loo, Jennifer Widom",International Conference on Management of Data,2001
r979,On schema matching with opaque column names and data values,"Jaewoo Kang, Jeffrey F. Naughton",International Conference on Management of Data,2003
r980,Telcordia's Database Reconciliation and Data Quality Analysis Tool,"Francesco Caruso, Munir Cochinwala, Uma Ganapathy, Gail Lalk, Paolo Missier",Very Large Data Bases,2000
r981,Chronological scheduling of transactions with temporal dependencies,"Dimitrios Georgakopoulos, Marek Rusinkiewicz, Witold Litwin",The VLDB Journal — The International Journal on Very Large Data Bases,1995
r982,Iceberg-cube computation with PC clusters,"Raymond T. Ng, Alan Wagner, Yu Yin",International Conference on Management of Data,2000
r983,HyperFile: a data and query model for documents,"Chris Clifton, Hector Garcia-Molina, David Bloom",The VLDB Journal — The International Journal on Very Large Data Bases,1995
r984,S3: similarity search in CAD database systems,"Stefan Berchtold, Hans-Peter Kriegel",International Conference on Management of Data,1997
r985,The National Medical Knowledge Bank,Warren Sterling,Very Large Data Bases,1999
r986,Emancipating instances from the tyranny of classes in information modeling,"Jeffrey Parsons, Yair Wand",ACM Transactions on Database Systems (TODS),2000
r987,Walking Through a Very Large Virtual Environment in Real-time,"Lidan Shou, Jason Chionh, Zhiyong Huang, Yixin Ruan, Kian-Lee Tan",Very Large Data Bases,2001
r988,DISNIC-PLAN: A NICNET Based Distributed Database for Micro-level Planning in India,M. Moni,Very Large Data Bases,1996
r989,An annotated bibliography on real-time database systems,Özgür Ulusoy,ACM SIGMOD Record,1995
r990,Report on DART '96: databases: active and real-time (concepts meet practice),"Krithi Ramamritham, Nandit Soparkar",ACM SIGMOD Record,1997
r991,Efficient Snapshot Differential Algorithms for Data Warehousing,"Wilburt Labio, Hector Garcia-Molina",Very Large Data Bases,1996
r992,WALRUS: a similarity retrieval algorithm for image databases,"Apostol Natsev, Rajeev Rastogi, Kyuseok Shim",International Conference on Management of Data,1999
r993,Spreadsheets in RDBMS for OLAP,"Andrew Witkowski, Srikanth Bellamkonda, Tolga Bozkaya, Gregory Dorman, Nathan Folkert, Abhinav Gupta, Lei Shen, Sankar Subramanian",International Conference on Management of Data,2003
r994,Incremental Organization for Data Recording and Warehousing,"H. V. Jagadish, P. P. S. Narayan, S. Seshadri, S. Sudarshan, Rama Kanneganti",Very Large Data Bases,1997
r995,Using SQL to Build New Aggregates and Extenders for Object- Relational Systems,"Haixun Wang, Carlo Zaniolo",Very Large Data Bases,1999
r996,Efficient and tumble similar set retrieval,"Aristides Gionis, Dimitrios Gunopulos, Nick Koudas",International Conference on Management of Data,2001
r997,FinTime: a financial time series benchmark,"Kaippallimalil J. Jacob, Dennis Shasha",ACM SIGMOD Record,1999
r998,Incremental updates of inverted lists for text document retrieval,"Anthony Tomasic, Héctor García-Molina, Kurt Shoens",International Conference on Management of Data,1994
r999,Surfing Wavelets on Streams: One-Pass Summaries for Approximate Aggregate Queries,"Anna C. Gilbert, Yannis Kotidis, S. Muthukrishnan, Martin Strauss",Very Large Data Bases,2001
r1000,DBLearn: a system prototype for knowledge discovery in relational databases,"Jiawei Han, Yongjian Fu, Yue Huang, Yandong Cai, Nick Cercone",International Conference on Management of Data,1994
r1001,Order-of-magnitude advantage on TPC-C through massive parallelism,Charles Levine,International Conference on Management of Data,1995
r1002,Spectral bloom filters,"Saar Cohen, Yossi Matias",International Conference on Management of Data,2003
r1003,In Cyber Space No One can Hear You Scream,Chris Pound,Very Large Data Bases,1999
r1004,Data bubbles: quality preserving performance boosting for hierarchical clustering,"Markus M. Breunig, Hans-Peter Kriegel, Peer Kröger, Jörg Sander",International Conference on Management of Data,2002
r1005,Information warfare and security,H. V. Jagadish,ACM SIGMOD Record,2000
r1006,Approximate computation of multidimensional aggregates of sparse data using wavelets,"Jeffrey Scott Vitter, Min Wang",International Conference on Management of Data,1999
r1007,Integration of heterogeneous databases without common domains using queries based on textual similarity,William W. Cohen,International Conference on Management of Data,1998
r1008,Xmas: an extensible main-memory storage system for high-performance applications,"Jang Ho Park, Yong Sik Kwon, Ki Hong Kim, Sang Ho Lee, Byoung Dae Park, Sang Kyun Cha",International Conference on Management of Data,1998
r1009,Update propagation strategies to improve freshness in lazy master replicated databases,"Esther Pacitti, Eric Simon",The VLDB Journal — The International Journal on Very Large Data Bases,2000
r1010,Constraints for semistructured data and XML,"Peter Buneman, Wenfei Fan, Jérôme Siméon, Scott Weinstein",ACM SIGMOD Record,2001
r1011,Of Objects and Databases: A Decade of Turmoil,"Michael J. Carey, David J. DeWitt",Very Large Data Bases,1995
r1012,Discovering Internet marketing intelligence through online analytical web usage mining,"Alex G. Büchner, Maurice D. Mulvenna",ACM SIGMOD Record,1998
r1013,Continually evaluating similarity-based pattern queries on a streaming time series,"Like Gao, X. Sean Wang",International Conference on Management of Data,2002
r1014,Formal semantics and analysis of object queries,G. M. Bierman,International Conference on Management of Data,2003
r1015,Query Optimization for XML,"Jason McHugh, Jennifer Widom",Very Large Data Bases,1999
r1016,Scientists called upon to take actions,Xiaolei Qian,ACM SIGMOD Record,1996
r1017,Component-based e-commerce: assessment of current practices and future directions,"Martin Bichler, Arie Segev, J. Leon Zhao",ACM SIGMOD Record,1998
r1018,A Scalable Architecture for Autonomous Heterogeneous Database Interactions,"Steven Milliner, Athman Bouguettaya, Mike P. Papazoglou",Very Large Data Bases,1996
r1019,A study on the management of semantic transaction for efficient data retrieval,"Shi Ming Huang, Irene Kwan, Chih He Li",ACM SIGMOD Record,2002
r1020,"Review of Spatial databases with application to GIS by Philippe Rigaux, Michel Scholl, and Agnes Voisard. Morgan Kaufmann 2002.",Nancy Wiegand,ACM SIGMOD Record,2003
r1021,DISIMA: a distributed and interoperable image database system,"Vincent Oria, M. Tamer Özsu, Paul J. Iglinski, Shu Lin, Bin Yao",International Conference on Management of Data,2000
