id,title,authors,venue,paper year
r1354,Multiway spatial joins,"Nikos Mamoulis, Dimitris Papadias",ACM Transactions on Database Systems (TODS),2001
r1355,Querying Continuous Time Sequences,"Ling Lin, Tore Risch",Very Large Data Bases,1997
r1356,Cover your assets,Michael A. Olson,International Conference on Management of Data,1995
r1357,Query execution techniques for caching expensive methods,"Joseph M. Hellerstein, Jeffrey F. Naughton",International Conference on Management of Data,1996
r1358,Data quality and data cleaning: an overview,"Theodore Johnson, Tamraparni Dasu",International Conference on Management of Data,2003
r1359,The network is the database: data management for highly distributed systems,"Julio C. Navas, Michael Wynblatt",International Conference on Management of Data,2001
r1360,Quest: a project on database mining,"R. Agrawal, M. Carey, C. Faloutsos, S. Ghosh, M. Houtsma, T. Imieliński, B. Iyer, A. Mahboob, H. Miranda, R. Srikant, A. Swami",International Conference on Management of Data,1994
r1361,The Oracle Warehouse,Gary Hallmark,Very Large Data Bases,1995
r1362,The Complexity of Transformation-Based Join Enumeration,"Arjan Pellenkoft, César A. Galindo-Legaria, Martin L. Kersten",Very Large Data Bases,1997
r1363,DBXplorer: enabling keyword search over relational databases,"Sanjay Agrawal, Surajit Chaudhuri, Gautam Das",International Conference on Management of Data,2002
r1364,Extended ephemeral logging: log storage management for applications with long lived transactions,"John S. Keen, William J. Dally",ACM Transactions on Database Systems (TODS),1997
r1365,An algebraic approach to static analysis of active database rules,"Elena Baralis, Jennifer Widom",ACM Transactions on Database Systems (TODS),2000
r1366,Random sampling for histogram construction: how much is enough?,"Surajit Chaudhuri, Rajeev Motwani, Vivek Narasayya",International Conference on Management of Data,1998
r1367,COSS: the common object services specifications,Bruce E. Martin,International Conference on Management of Data,1994
r1368,Resource Scheduling in Enhanced Pay-Per-View Continuous Media Databases,"Minos N. Garofalakis, Banu Özden, Abraham Silberschatz",Very Large Data Bases,1997
r1369,Adaptable query optimization and evaluation in temporal middleware,"Giedrius Slivinskas, Christian S. Jensen, Richard Thomas Snodgrass",International Conference on Management of Data,2001
r1370,Data warehousing and OLAP for decision support,"Surajit Chaudhuri, Umeshwar Dayal",International Conference on Management of Data,1997
r1371,An Extendible Hash for Multi-Precision Similarity Querying of Image Databases,"Shu Lin, M. Tamer Özsu, Vincent Oria, Raymond T. Ng",Very Large Data Bases,2001
r1372,"SQL: 1999, formerly known as SQL3","Andrew Eisenberg, Jim Melton",ACM SIGMOD Record,1999
r1373,Spatial join selectivity using power laws,"Christos Faloutsos, Bernhard Seeger, Agma Traina, Caetano Traina, Jr.",International Conference on Management of Data,2000
r1374,Join queries with external text sources: execution and optimization techniques,"Surajit Chaudhuri, Umeshwar Dayal, Tak W. Yan",International Conference on Management of Data,1995
r1375,UniSQL/X unified relational and object-oriented database system,Won Kim,International Conference on Management of Data,1994
r1376,Distance-based outliers: algorithms and applications,"Edwin M. Knorr, Raymond T. Ng, Vladimir Tucakov",The VLDB Journal — The International Journal on Very Large Data Bases,2000
r1377,Visual Web Information Extraction with Lixto,"Robert Baumgartner, Sergio Flesca, Georg Gottlob",Very Large Data Bases,2001
r1378,The middleware muddle,David Ritter,ACM SIGMOD Record,1998
r1379,Similarity based Retrieval of Pictures Using Indices on Spatial Relationships,"A. Prasad Sistla, Clement T. Yu, Chengwen Liu, King Liu",Very Large Data Bases,1995
r1380,Query previews for networked information systems: a case study with NASA environmental data,"Khoa Doan, Catherine Plaisant, Ben Shneiderman, Tom Bruns",ACM SIGMOD Record,1997
r1381,Heraclitus: elevating deltas to be first-class citizens in a database programming language,"Shahram Ghandeharizadeh, Richard Hull, Dean Jacobs",ACM Transactions on Database Systems (TODS),1996
r1382,The design of a retrieval technique for high-dimensional data on tertiary storage,"Ratko Orlandic, Jack Lukaszuk, Craig Swietlik",ACM SIGMOD Record,2002
r1383,Computing complete answers to queries in the presence of limited access patterns,Chen Li,The VLDB Journal — The International Journal on Very Large Data Bases,2003
r1384,HODFA: an architectural framework for homogenizing heterogeneous legacy databases,"Kamalakar Karlapalem, Qing Li, Chung-Dak Shum",ACM SIGMOD Record,1995
r1385,Distributed transactions in practice,"Prabhu Ram, Lyman Do, Pamela Drew",ACM SIGMOD Record,1998
r1386,QCluster: relevance feedback using adaptive clustering for content-based image retrieval,"Deok-Hwan Kim, Chin-Wan Chung",International Conference on Management of Data,2003
r1387,Integration of electronic tickets and personal guide system for public transport using mobile terminals,"Koichi Goto, Yahiko Kambayashi",International Conference on Management of Data,2003
r1388,FeedbackBypass: A New Approach to Interactive Similarity Query Processing,"Ilaria Bartolini, Paolo Ciaccia, Florian Waas",Very Large Data Bases,2001
r1389,Research issues for data communication in mobile ad-hoc network database systems,"Leslie D. Fife, Le Gruenwald",ACM SIGMOD Record,2003
r1390,"On building an infrastructure for mobile and wireless systems: report on the NSF workshop on an infrastructure for mobile and wireless systems, Oct. 15, 2001","Birgitta König-Ries, Kia Makki, Sam Makki, Charles Perkins, Niki Pissinou, Peter Reiher, Peter Scheuermann, Jari Veijalainen, Ouri Wolfson",ACM SIGMOD Record,2002
r1391,"Fast Similarity Search in the Presence of Noise, Scaling, and Translation in Time-Series Databases","Rakesh Agrawal, King-Ip Lin, Harpreet S. Sawhney, Kyuseok Shim",Very Large Data Bases,1995
r1392,OPOSSUM: Desk-Top Schema Management through Customizable Visualization,"Eben M. Haber, Yannis E. Ioannidis, Miron Livny",Very Large Data Bases,1995
r1393,Template-based wrappers in the TSIMMIS system,"Joachim Hammer, Héctor García-Molina, Svetlozar Nestorov, Ramana Yerneni, Marcus Breunig, Vasilis Vassalos",International Conference on Management of Data,1997
r1394,Query optimization at the crossroads,Surajit Chaudhuri,International Conference on Management of Data,1997
r1395,Datawarehousing Has More Colours Than Just Black &; White,"Thomas Zurek, Markus Sinnwell",Very Large Data Bases,1999
r1396,Recovery protocols for shared memory database systems,"Lory D. Molesky, Krithi Ramamritham",International Conference on Management of Data,1995
r1397,PIX: exact and approximate phrase matching in XML,"Sihem Amer-Yahia, Mary Fernández, Divesh Srivastava, Yu Xu",International Conference on Management of Data,2003
r1398,Integration approaches for CIM,Moira C. Norrie,International Conference on Management of Data,1994
r1399,Red brick warehouse: a read-mostly RDBMS for open SMP platforms,Phillip M. Fernandez,International Conference on Management of Data,1994
r1400,Memory-Contention Responsive Hash Joins,"Diane L. Davison, Goetz Graefe",Very Large Data Bases,1994
r1401,MQseries and CICS link for Lotus Notes,Lotus Development Corp.,ACM SIGMOD Record,1996
r1402,"Building a scaleable geo-spatial DBMS: technology, implementation, and evaluation","Jignesh Patel, JieBing Yu, Navin Kabra, Kristin Tufte, Biswadeep Nag, Josef Burger, Nancy Hall, Karthikeyan Ramasamy, Roger Lueder, Curt Ellmann, Jim Kupsch, Shelly Guo, Johan Larson, David De Witt, Jeffrey Naughton",International Conference on Management of Data,1997
r1403,Storing semistructured data with STORED,"Alin Deutsch, Mary Fernandez, Dan Suciu",International Conference on Management of Data,1999
r1404,Mining frequent patterns without candidate generation,"Jiawei Han, Jian Pei, Yiwen Yin",International Conference on Management of Data,2000
r1405,Beyond document similarity: understanding value-based search and browsing technologies,"Andreas Paepcke, Hector Garcia-Molina, Gerard Rodriguez-Mula, Junghoo Cho",ACM SIGMOD Record,2000
r1406,Benchmarking queries over trees: learning the hard truth the hard way,"Fanny Wattez, Sophie Cluet, Véronique Benzaken, Guy Ferran, Christian Fiegel",International Conference on Management of Data,2000
r1407,Data modeling of time-based media,"Simon Gibbs, Christian Breiteneder, Dennis Tsichritzis",International Conference on Management of Data,1994
r1408,Highly concurrent cache consistency for indices in client-server database systems,"Markos Zaharioudakis, Michael J. Carey",International Conference on Management of Data,1997
r1409,A Quantitative Analysis and Performance Study for Similarity-Search Methods in High-Dimensional Spaces,"Roger Weber, Hans-Jörg Schek, Stephen Blott",Very Large Data Bases,1998
r1410,Evaluating Functional Joins Along Nested Reference Sets in Object-Relational and Object-Oriented Databases,"Reinhard Braumandl, Jens Claußen, Alfons Kemper",Very Large Data Bases,1998
r1411,"TPC-DS, taking decision support benchmarking to the next level","Meikel Poess, Bryan Smith, Lubor Kollar, Paul Larson",International Conference on Management of Data,2002
r1412,Why I like working in academia,Richard Thomas Snodgrass,ACM SIGMOD Record,2002
r1413,Incremental Clustering for Mining in a Data Warehousing Environment,"Martin Ester, Hans-Peter Kriegel, Jörg Sander, Michael Wimmer, Xiaowei Xu",Very Large Data Bases,1998
r1414,Guest editorial,"Paolo Atzeni, Alberto O. Mendelzon",The VLDB Journal — The International Journal on Very Large Data Bases,1999
r1415,On random sampling over joins,"Surajit Chaudhuri, Rajeev Motwani, Vivek Narasayya",International Conference on Management of Data,1999
r1416,Two techniques for on-line index modification in shared nothing parallel databases,"Kiran J. Achyutuni, Edward Omiecinski, Shamkant B. Navathe",International Conference on Management of Data,1996
r1417,Data analysis and mining in the life sciences,Nam Huyn,ACM SIGMOD Record,2001
r1418,Monotonic complements for independent data warehouses,"D. Laurent, J. Lechtenbörger, N. Spyratos, G. Vossen",The VLDB Journal — The International Journal on Very Large Data Bases,2001
r1419,PREDATOR: a resource for database research,Praveen Seshadri,ACM SIGMOD Record,1998
r1420,Semantic and schematic similarities between database objects: a context-based approach,"Vipul Kashyap, Amit Sheth",The VLDB Journal — The International Journal on Very Large Data Bases,1996
r1421,Exploiting main memory DBMS features to improve real-time concurrency control protocols,"Özgür Ulusoy, Alejandro Buchmann",ACM SIGMOD Record,1996
r1422,Approximate String Joins in a Database (Almost) for Free,"Luis Gravano, Panagiotis G. Ipeirotis, H. V. Jagadish, Nick Koudas, S. Muthukrishnan, Divesh Srivastava",Very Large Data Bases,2001
r1423,Exchanging intensional XML data,"Tova Milo, Serge Abiteboul, Bernd Amann, Omar Benjelloun, Fred Dang Ngoc",International Conference on Management of Data,2003
r1424,Towards an infrastructure for temporal databases: report of an invitational ARPA/NSF workshop,"Niki Pissinou, Richard Thomas Snodgrass, Ramez Elmasri, Inderpal S. Mumick, Tamer Özsu, Barbara Pernici, Arie Segev, Babis Theodoulidis, Umeshwar Dayal",ACM SIGMOD Record,1994
r1425,Linking Business to Deliver Value: A Data Management Challenge,Anand Deshpande,Very Large Data Bases,2000
r1426,An aspect of query optimization in multidatabase systems,"Chiang Lee, Chia-Jung Chen, Hongjun Lu",ACM SIGMOD Record,1995
r1427,"Database tuning: principles, experiments, and troubleshooting techniques (part I)","Dennis Shasha, Philippe Bonnet",International Conference on Management of Data,2002
r1428,Contrast Plots and P-Sphere Trees: Space vs. Time in Nearest Neighbour Searches,"Jonathan Goldstein, Raghu Ramakrishnan",Very Large Data Bases,2000
r1429,Improving timeliness in real-time secure database systems,"Sang H. Son, Rasikan David, Bhavani Thuraisingham",ACM SIGMOD Record,1997
r1430,The Challenge of Process Data Warehousing,"Matthias Jarke, Thomas List, Jörg Köller",Very Large Data Bases,2000
r1431,Information Management for Genome Level Bioinformatics,"Norman W. Paton, Carole A. Goble",Very Large Data Bases,2001
r1432,COUGAR: the network is the database,"Wai Fu Fung, David Sun, Johannes Gehrke",International Conference on Management of Data,2002
r1433,Transactional publish/subscribe: the proactive multicast of database changes (abstract),Arvola Chan,International Conference on Management of Data,1998
r1434,Mobile computing and databases: anything new?,"Margaret H. Dunham, Abdelsalam Helal",ACM SIGMOD Record,1995
r1435,Methodology for development and employment of ontology based knowledge management applications,"York Sure, Steffen Staab, Rudi Studer",ACM SIGMOD Record,2002
r1436,A Data Warehousing Architecture for Enabling Service Provisioning Process,Yannis Kotidis,Very Large Data Bases,2001
r1437,"Watermarking relational data: framework, algorithms and analysis","Rakesh Agrawal, Peter J. Haas, Jerry Kiernan",The VLDB Journal — The International Journal on Very Large Data Bases,2003
r1438,NiagaraCQ: a scalable continuous query system for Internet databases,"Jianjun Chen, David J. DeWitt, Feng Tian, Yuan Wang",International Conference on Management of Data,2000
r1439,ACM Multimedia '94 conference workshop on multimedia database management systems,"Bruce Berra, Kingsley Nwosu, Bhavani Thuraisingham",ACM SIGMOD Record,1995
r1440,W3QS: A Query System for the World-Wide Web,"David Konopnicki, Oded Shmueli",Very Large Data Bases,1995
r1441,WinMagic: subquery elimination using window aggregation,"Calisto Zuzarte, Hamid Pirahesh, Wenbin Ma, Qi Cheng, Linqi Liu, Kwai Wong",International Conference on Management of Data,2003
r1442,Concept based design of data warehouses: the DWQ demonstrators,"M. Jarke, C. Quix, D. Calvanese, M. Lenzerini, E. Franconi, S. Ligoudistianos, P. Vassiliadis, Y. Vassiliou",International Conference on Management of Data,2000
r1443,Scientific data repositories: designing for a moving target,"Etzard Stolte, Christoph von Praun, Gustavo Alonso, Thomas Gross",International Conference on Management of Data,2003
r1444,Condition handling in SQL persistent stored modules,Jeff Richey,ACM SIGMOD Record,1995
r1445,MOSAICO-a system for conceptual modeling and rapid prototyping of object-oriented database application,"M. Missikoff, M. Toiati",International Conference on Management of Data,1994
r1446,Supporting multiple view maintenance policies,"Latha S. Colby, Akira Kawaguchi, Daniel F. Lieuwen, Inderpal Singh Mumick, Kenneth A. Ross",International Conference on Management of Data,1997
r1447,Description logics for semantic query optimization in object-oriented database systems,"Domenico Beneventano, Sonia Bergamaschi, Claudio Sartori",ACM Transactions on Database Systems (TODS),2003
r1448,A Region Splitting Strategy for Physical Database Design of Multidimensional File Organizations,"Jong-Hak Lee, Young-Koo Lee, Kyu-Young Whang, Il-Yeol Song",Very Large Data Bases,1997
r1449,The impact of database research on industrial products (panel),"José A. Blakeley, Dan Fishman, David Lomet, Michael Stonebraker",ACM SIGMOD Record,1994
r1450,Dynamic resource brokering for multi-user query execution,"Diane L. Davison, Goetz Graefe",International Conference on Management of Data,1995
r1451,Fast Evaluation Techniques for Complex Similarity Queries,"Klemens Böhm, Michael Mlivoncic, Hans-Jörg Schek, Roger Weber",Very Large Data Bases,2001
r1452,XmdvTool: visual interactive data exploration and trend discovery of high-dimensional data sets,"Elke A. Rundensteiner, Matthew O. Ward, Jing Yang, Punit R. Doshi",International Conference on Management of Data,2002
r1453,Information integration on the Web: a view from AI and databases (report on IIWeb-03),"Subbarao Kambhampati, Craig A. Knoblock",ACM SIGMOD Record,2003
r1454,Optimal Grid-Clustering: Towards Breaking the Curse of Dimensionality in High-Dimensional Clustering,"Alexander Hinneburg, Daniel A. Keim",Very Large Data Bases,2000
r1455,Peer-to-peer research at Stanford,"Mayank Bawa, Brian F. Cooper, Arturo Crespo, Neil Daswani, Prasanna Ganesan, Hector Garcia-Molina, Sepandar Kamvar, Sergio Marti, Mario Schlosser, Qi Sun, Patrick Vinograd, Beverly Yang",ACM SIGMOD Record,2003
r1456,RETINA: a real-time traffic navigation system,"Kam-Yiu Lam, Edward Chan, Tei-Wei Kuo, S. W. Ng, Dick Hung",International Conference on Management of Data,2001
r1457,A Novel Index Supporting High Volume Data Warehouse Insertion,"Chris Jermaine, Anindya Datta, Edward Omiecinski",Very Large Data Bases,1999
r1458,Semantic Data Caching and Replacement,"Shaul Dar, Michael J. Franklin, Björn Þór Jónsson, Divesh Srivastava, Michael Tan",Very Large Data Bases,1996
r1459,QC-trees: an efficient summary structure for semantic OLAP,"Laks V. S. Lakshmanan, Jian Pei, Yan Zhao",International Conference on Management of Data,2003
r1460,Improving Adaptable Similarity Query Processing by Using Approximations,"Mihael Ankerst, Bernhard Braunmüller, Hans-Peter Kriegel, Thomas Seidl",Very Large Data Bases,1998
r1461,Optimal Histograms with Quality Guarantees,"H. V. Jagadish, Nick Koudas, S. Muthukrishnan, Viswanath Poosala, Kenneth C. Sevcik, Torsten Suel",Very Large Data Bases,1999
r1462,The DEDALE system for complex spatial queries,"Stéphane Grumbach, Philippe Rigaux, Luc Segoufin",International Conference on Management of Data,1997
r1463,Spatial queries in dynamic environments,"Yufei Tao, Dimitris Papadias",ACM Transactions on Database Systems (TODS),2003
r1464,Broadcast disks: data management for asymmetric communication environments,"Swarup Acharya, Rafael Alonso, Michael Franklin, Stanley Zdonik",International Conference on Management of Data,1995
r1465,Efficient similarity search and classification via rank aggregation,"Ronald Fagin, Ravi Kumar, D. Sivakumar",International Conference on Management of Data,2003
r1466,InfoSleuth: agent-based semantic integration of information in open and dynamic environments,"R. J. Bayardo, Jr., W. Bohrer, R. Brice, A. Cichocki, J. Fowler, A. Helal, V. Kashyap, T. Ksiezyk, G. Martin, M. Nodine, M. Rashid, M. Rusinkiewicz, R. Shea, C. Unnikrishnan, A. Unruh, D. Woelk",International Conference on Management of Data,1997
r1467,Dynamic vp-tree indexing for n-nearest neighbor search given pair-wise distances,"Ada Wai-chee Fu, Polly Mei-shuen Chan, Yin-Ling Cheung, Yiu Sang Moon",The VLDB Journal — The International Journal on Very Large Data Bases,2000
r1468,Index-driven similarity search in metric spaces,"Gisli R. Hjaltason, Hanan Samet",ACM Transactions on Database Systems (TODS),2003
r1469,Deadlock detection in distributed database systems: a new algorithm and a comparative performance analysis,"Natalija Krivokapić, Alfons Kemper, Ehud Gudes",The VLDB Journal — The International Journal on Very Large Data Bases,1999
r1470,An Empirical Performance Study of the Ingres Search Accelerator for a Large Property Management Database System,"Sarabjot S. Anand, David A. Bell, John G. Hughes",Very Large Data Bases,1994
r1471,Towards a database body of knowledge: a study from Spain,"Coral Calero, Mario Piattini, Francisco Ruiz",ACM SIGMOD Record,2003
r1472,Report on XEWA-00: the XML enabled wide-area searches for bioinformatics workshop,Terence Critchlow,ACM SIGMOD Record,2001
r1473,"Research in databases and data-intensive applications: Computer Science Dept. and FIZ, University of Karlsruhe","Brigitta König-Ries, Peter C. Lockermann",ACM SIGMOD Record,1997
r1474,PicoDMBS: Scaling Down Database Techniques for the Smartcard,"Christophe Bobineau, Luc Bouganim, Philippe Pucheral, Patrick Valduriez",Very Large Data Bases,2000
r1475,1-Safe Algorithms for Symmetric Site Configurations,"Rune Humborstad, Maitrayi Sabaratnam, Svein-Olaf Hvasshovd, Øystein Torbjørnsen",Very Large Data Bases,1997
r1476,From VLDB to VMLDB (Very MANY Large Data Bases): Dealing with Large-Scale Semantic Heterogenity,Stuart E. Madnick,Very Large Data Bases,1995
r1477,The WASA2 object-oriented workflow management system,"Gottfried Vossen, Mathias Weske",International Conference on Management of Data,1999
r1478,Engineering federated information systems: report of EEFIS '99 workshop,"S. Conrad, W. Hasselbring, U. Hohenstein, R.-D. Kutsche, M. Roantree, G. Saake, F. Saltor",ACM SIGMOD Record,1999
r1479,Database De-Centralization - A Practical Approach,"Tor Didriksen, César A. Galindo-Legaria, Eirik Dahle",Very Large Data Bases,1996
r1480,Building database-driven electronic catalogs,Sherif Danish,ACM SIGMOD Record,1998
r1481,Database in crisis and transition: a technical agenda for the year 2001,David Vaskevitch,International Conference on Management of Data,1994
r1482,Control strategies for complex relational query processing in shared nothing systems,"Lionel Brunie, Harald Kosch",ACM SIGMOD Record,1996
r1483,3D geographic network displays,"Kenneth C. Cox, Stephen G. Eick, Taosong He",ACM SIGMOD Record,1996
r1484,"Biodiversity Informatics: The Challenge of Rapid Development, Large Databases, and Complex Data (Keynote)","Meridith A. Lane, James L. Edwards, Ebbe Nielsen",Very Large Data Bases,1999
r1485,Rights protection for relational data,"Radu Sion, Mikhail Atallah, Sunil Prabhakar",International Conference on Management of Data,2003
r1486,Bringing order to query optimization,"Giedrius Slivinskas, Christian S. Jensen, Richard Thomas Snodgrass",ACM SIGMOD Record,2002
r1487,Microsoft English Query 7.5: Automatic Extraction of Semantics from Relational Databases and OLAP Cubes,Adam Blum,Very Large Data Bases,1999
r1488,EXACT: an extensible approach to active object-oriented databases,"Oscar Díaz, Arturo Jaime",The VLDB Journal — The International Journal on Very Large Data Bases,1997
r1489,Focused Crawling Using Context Graphs,"Michelangelo Diligenti, Frans Coetzee, Steve Lawrence, C. Lee Giles, Marco Gori",Very Large Data Bases,2000
r1490,BeSS: storage support for interactive visualization systems,"A. Biliris, T. A. Funkhouser, W. O'Connell, E. Panagos",International Conference on Management of Data,1996
r1491,SERF: ODMG-based generic re-structuring facility,"E. A. Rundensteiner, K. Claypool, M. Li, L. Chen, Z. Zhang, C. Natarajan, J. Jin, S. De Lima, S. Weiner",International Conference on Management of Data,1999
r1492,Issues in Network Management in the Next Millennium,"Michael L. Brodie, Surajit Chaudhuri",Very Large Data Bases,1999
r1493,A Sequential Pattern Query Language for Supporting Instant Data Mining for e-Services,"Reza Sadri, Carlo Zaniolo, Amir M. Zarkesh, Jafar Adibi",Very Large Data Bases,2001
r1494,Metadata for multimedia documents,"Klemens Böhm, Thomas C. Rakow",ACM SIGMOD Record,1994
r1495,Parallel database systems in the 1990's,Michael J. Carey,International Conference on Management of Data,1994
r1496,Toward network data independence,Joseph M. Hellerstein,ACM SIGMOD Record,2003
r1497,An adaptive peer-to-peer network for distributed caching of OLAP results,"Panos Kalnis, Wee Siong Ng, Beng Chin Ooi, Dimitris Papadias, Kian-Lee Tan",International Conference on Management of Data,2002
r1498,DB2 Query Parallelism: Staging and Implementation,Yun Wang,Very Large Data Bases,1996
r1499,A taxonomy for secure object-oriented databases,"Martin S. Olivier, Sebastiaan H. von Solms",ACM Transactions on Database Systems (TODS),1994
r1500,Dynamic maintenance of data distribution for selectivity estimation,"Kyu Young Whang, Sang Wook Kim, Gio Wiederhold",The VLDB Journal — The International Journal on Very Large Data Bases,1994
r1501,Partitioned garbage collection of a large object store,"Umesh Maheshwari, Barbara Liskov",International Conference on Management of Data,1998
r1502,Open object database management systems,José A. Blakeley,International Conference on Management of Data,1994
r1503,Delaunay: a database visualization system,"Isabel F. Cruz, M. Averbuch, Wendy T. Lucas, Melissa Radzyminski, Kirby Zhang",International Conference on Management of Data,1997
r1504,"DB2 Common Server: Technology, Progress, &; Directions",Bruce G. Lindsay,Very Large Data Bases,1995
r1505,Locating and accessing data repositories with WebSemantics,"George A. Mihaila, Louiqa Raschid, Anthony Tomasic",The VLDB Journal — The International Journal on Very Large Data Bases,2002
r1506,A multi-paradigm querying approach for a generic multimedia database management system,"Ji-Rong Wen, Qing Li, Wei-Ying Ma, Hong-Jiang Zhang",ACM SIGMOD Record,2003
r1507,Delivering presentations from multimedia servers,"Nevzat Hurkan Balkir, Gultekin Ozsoyoglu",The VLDB Journal — The International Journal on Very Large Data Bases,1998
r1508,On Optimal Node Splitting for R-trees,"Yván J. García, Mario A. Lopez, Scott T. Leutenegger",Very Large Data Bases,1998
r1509,Data replication for mobile computers,"Yixiu Huang, Prasad Sistla, Ouri Wolfson",International Conference on Management of Data,1994
r1510,An execution model for limited ambiguity rules and its application to derived data update,"I.-Min A. Chen, Richard Hull, Dennis McLeod",ACM Transactions on Database Systems (TODS),1995
r1511,"StorHouse metanoia - new applications for database, storage &; data warehousing","Felipe Cariño, Jr., Pekka Kostamaa, Art Kaufmann, John Burgess",International Conference on Management of Data,2001
r1512,Normalization in OODB design,Byung S. Lee,ACM SIGMOD Record,1995
r1513,Efficient Progressive Skyline Computation,"Kian-Lee Tan, Pin-Kwang Eng, Beng Chin Ooi",Very Large Data Bases,2001
r1514,Implementing the spirit of SQL-99,Paul Brown,International Conference on Management of Data,1999
r1515,Concurrent Garbage Collection in O2,"Marcin Skubiszewski, Patrick Valduriez",Very Large Data Bases,1997
