ID,title,booktitle,author,pages,year,organization,ENTRYTYPE,publisher,journal,number,volume
698,Elimination of subjectivity from trust recommendation,Trust Management III,"Hasan, Omar and Brunie, Lionel and Pierson, Jean-Marc and Bertino, Elisa",65--80,2009,,incollection,Springer Berlin Heidelberg,,,
699,The effects of two-phase locking on the performance of a distributed database management system,,"Thanos, Costantino and Bertino, Elisa and Carlesi, Carlo",129--157,1988,,article,Elsevier,Performance Evaluation,2,8
700,Position transformation: a location privacy protection method for moving objects,Proceedings of the SIGSPATIAL ACM GIS 2008 International Workshop on Security and Privacy in GIS and LBS,"Lin, Dan and Bertino, Elisa and Cheng, Reynold and Prabhakar, Sunil",62--71,2008,ACM,inproceedings,,,,
701,Handling expiration of multigranular temporal objects,,"Camossi, Elena and Bertino, Elisa and Mesiti, Marco and Guerrini, Giovanna",23--50,2004,,article,Oxford Univ Press,Journal of Logic and Computation,1,14
702,Securing dbms: characterizing and detecting query floods,Information Security,"Bertino, Elisa and Leggieri, Teodoro and Terzi, Evimaria",195--206,2004,,incollection,Springer Berlin Heidelberg,,,
703,Location-based access control systems for mobile users: concepts and research directions,Proceedings of the 4th ACM SIGSPATIAL International Workshop on Security and Privacy in GIS and LBS,"Bertino, Elisa and Kirkpatrick, Michael S",49--52,2011,ACM,inproceedings,,,,
704,Max: An access control system for digital libraries and the web,"Computer Software and Applications Conference, 2002. COMPSAC 2002. Proceedings. 26th Annual International","Bertino, Elisa and Ferrari, Elena and Perego, Andrea",945--950,2002,IEEE,inproceedings,,,,
705,Supporting delegation in secure workflow management systems,Data and Applications Security XVII,"Atluri, Vijayalakshmi and Bertino, Elisa and Ferrari, Elena and Mazzoleni, Pietro",190--202,2004,,incollection,Springer US,,,
706,An object-relational approach to the representation of multi-granular spatio-temporal data,Advanced Information Systems Engineering,"Bertino, Elisa and Cuadra, Dolores and Mart{\'\i}nez, Paloma",119--134,2005,,incollection,Springer Berlin Heidelberg,,,
707,Secure data aggregation technique for wireless sensor networks in the presence of collusion attacks,,"Rezvani, Mohsen and Ignjatovic, Aleksandar and Bertino, Elisa and Jha, Somesh",98--110,2015,,article,IEEE,"Dependable and Secure Computing, IEEE Transactions on",1,12
708,Towards a fine-grained access control model and mechanisms for semantic databases,"Web Services, 2007. ICWS 2007. IEEE International Conference on","Franzoni, Stefano and Mazzoleni, Pietro and Valtolina, Stefano and Bertino, Elisa",993--1000,2007,IEEE,inproceedings,,,,
709,Systematic control and management of data integrity,Proceedings of the eleventh ACM symposium on Access control models and technologies,"Byun, Ji-Won and Sohn, Yonglak and Bertino, Elisa",101--110,2006,ACM,inproceedings,,,,
710,Private searching for single and conjunctive keywords on streaming data,Proceedings of the 10th annual ACM workshop on Privacy in the electronic society,"Yi, Xun and Bertino, Elisa",153--158,2011,ACM,inproceedings,,,,
711,Correctness of semantic integrity checking in database management systems,,"Bertino, Elisa and Musto, Daniela",25--57,1988,,article,Springer-Verlag,Acta Informatica,02-Jan,26
712,Using automated individual white-list to protect web digital identities,,"Han, Weili and Cao, Ye and Bertino, Elisa and Yong, Jianming",11861--11869,2012,,article,Pergamon,Expert Systems with Applications,15,39
713,FENCE: Continuous access control enforcement in dynamic data stream environments,Proceedings of the third ACM conference on Data and application security and privacy,"Nehme, Rimma V and Lim, Hyo-Sang and Bertino, Elisa",243--254,2013,ACM,inproceedings,,,,
714,Privacy-preserving similarity measurement for access control policies,Proceedings of the 6th ACM workshop on Digital identity management,"Cho, Eun and Ghinita, Gabriel and Bertino, Elisa",3--12,2010,ACM,inproceedings,,,,
715,A characterization of the problem of secure provenance management,"Intelligence and Security Informatics, 2009. ISI'09. IEEE International Conference on","Xu, Shouhuai and Ni, Qun and Bertino, Elisa and Sandhu, Ravi",310--314,2009,IEEE,inproceedings,,,,
716,Optimization of object-oriented queries using path indices,"Research Issues on Data Engineering, 1992: Transaction and Query Processing, Second International Workshop on","Bertino, Elisa and Guglielmina, Claudia",140--149,1992,IEEE,inproceedings,,,,
717,Workflow authorisation in mediator-free environments,,"Shehab, Mohamed and Bertino, Elisa and Ghafoor, Arif",2--12,2006,,article,Inderscience Publishers,International Journal of Security and Networks,02-Jan,1
718,Spatial domains for the administration of location-based access control policies,,"Damiani, Maria Luisa and Bertino, Elisa and Silvestri, Claudio",277--302,2008,,article,Springer US,Journal of Network and Systems Management,3,16
719,"Degrees of isolation, concurrency control protocols, and commit protocols",Proceedings of the IFIP WG11. 3 Working Conference on Database Security VII,"Atluri, Vijayalakshmi and Bertino, Elisa and Jajodia, Sushil",259--274,1994,North-Holland Publishing Co.,inproceedings,,,,
720,An object-oriented data model for distributed office applications,ACM SIGOIS Bulletin,"Bertino, Elisa and Negri, M and Pelagatti, G and Sbattella, L",216--226,1990,ACM,inproceedings,,,03-Feb,11
721,Group-based negotiations in p2p systems,,"Squicciarini, Anna C and Paci, Federica and Bertino, Elisa and Trombetta, Alberto and Braghin, Stefano",1473--1486,2010,,article,IEEE,"Parallel and Distributed Systems, IEEE Transactions on",10,21
722,Policy monitoring with user-preferences in PDL,,"Bertino, Elisa and Mileo, Alessandra and Provetti, Alessandro",37--44,2003,,article,Citeseer,"Proceedings of IJCAI-03 Workshop for Nonmonotonic Reasoning, Action and Change",,
723,Alternative correctness criteria for concurrent execution of transactions in multilevel secure databases,,"Atluri, Vijayalakshmi and Jajodia, Sushil and Bertino, Elisa",839--854,1996,,article,IEEE,"Knowledge and Data Engineering, IEEE Transactions on",5,8
724,Security in SOA and web services,"Services Computing, 2006. SCC'06. IEEE International Conference on","Bertino, Elisa and Martino, Lorenzo",xli--xli,2006,IEEE,inproceedings,,,,
725,Privacy requirements in identity management solutions,Human Interface and the Management of Information. Interacting in Information Environments,"Bhargav-Spantzel, Abhilasha and Squicciarini, Anna C and Young, Matthew and Bertino, Elisa",694--702,2007,,incollection,Springer Berlin Heidelberg,,,
726,Extended RBAC with role attributes,,"Yong, Jianming and Bertino, Elisa and Roberts, Mark Toleman Dave",8,2006,,article,,PACIS 2006 Proceedings,,
727,Merkle tree authentication in UDDI registries,,"Bertino, Elisa and Carminati, Barbara and Ferrari, Elena",37--57,2004,,article,,Int. J. Web Service Res.,2,1
728,"CONCERTO, an environment for the “intelligent’indexing, querying and retrieval of digital documents",Foundations of Intelligent Systems,"Zarri, Gian Piero and Bertino, Elisa and Black, Bill and Brasher, Andrew and Catania, Barbara and Deavin, Diana and Di Pace, Liugi and Esposito, Floriana and Leo, Pietro and McNaught, John and others",226--234,1999,,incollection,Springer Berlin Heidelberg,,,
729,Clustering techniques in object bases: a survey,,"Bertino, Elisa and Saad, Amani A and Ismail, Mohamed A.",255--275,1994,,article,Elsevier,Data \& knowledge engineering,3,12
730,Access control policy analysis and visualization tools for security professionals,,"Vaniea, Kami and Ni, Qun and Cranor, Lorrie and Bertino, Elisa",,2008,,article,,Proceedings of the 4th Symposium on Usable Privacy and Security (SOUPS'08),,
731,Privacy-preserving enforcement of spatially aware RBAC,,"Kirkpatrick, Michael S and Ghinita, Gabriel and Bertino, Elisa",627--640,2012,,article,IEEE,"Dependable and Secure Computing, IEEE Transactions on",5,9
732,Querying multiple temporal granularity data,"Temporal Representation and Reasoning, 2000. TIME 2000. Proceedings. Seventh International Workshop on","Merlo, Isabella and Bertino, Elisa and Ferrari, Elena and Gadia, Shashi and Guerrini, Giovanna",103--114,2000,IEEE,inproceedings,,,,
733,A Bottom-Up Interpreter for a Database Language with Updates and Transactions.,GULP-PRODE (2),"Bertino, Elisa and Catania, Barbara and Guerrini, Giovanna and Martelli, Maurizio and Montesi, Danilo",206--220,1994,,inproceedings,,,,
734,Specification and enforcement of flexible security policy for active cooperation,,"Sun, Yuqing and Gong, Bin and Meng, Xiangxu and Lin, Zongkai and Bertino, Elisa",2629--2642,2009,,article,Elsevier,Information Sciences,15,179
735,A comprehensive simulation tool for the analysis of password policies,,"Shay, Richard and Bertino, Elisa",275--289,2009,,article,Springer-Verlag,International Journal of Information Security,4,8
736,Single-database private information retrieval from fully homomorphic encryption,,"Yi, Xun and Kaosar, Mohammed Golam and Paulet, Russell and Bertino, Elisa",1125--1134,2013,,article,IEEE,"Knowledge and Data Engineering, IEEE Transactions on",5,25
737,A framework for contractual resource sharing in coalitions,"Policies for Distributed Systems and Networks, 2004. POLICY 2004. Proceedings. Fifth IEEE International Workshop on","Firozabadi, Babak Sadighi and Sergot, Marek and Squicciarin, A and Bertino, Elisa",117--126,2004,IEEE,inproceedings,,,,
738,Protecting location privacy through semantics-aware obfuscation techniques,Trust Management II,"Damiani, Maria Luisa and Bertino, Elisa and Silvestri, Claudio",231--245,2008,,incollection,Springer US,,,
739,Measuring the structural similarity among XML documents and DTDs,,"Bertino, Elisa and Guerrini, Giovanna and Mesiti, Marco and Rivara, I and others",,2001,,article,Citeseer,,,
740,Issues on modeling spatial granularities,,"Camossi, Elena and Bertolotto, Michela and Bertino, Elisa and Guerrini, Giovanna",,2003,,article,,COSIT,,
741,Threat modelling for SQL Servers,Communications and Multimedia Security,"Bertino, E and Bruschi, D and Franzoni, S and Nai-Fovino, I and Valtolina, S",159--171,2005,,incollection,Springer US,,,
742,"Access control, confidentiality and privacy for video surveillance databases",Proceedings of the eleventh ACM symposium on Access control models and technologies,"Thuraisingham, Bhavani and Lavee, Gal and Bertino, Elisa and Fan, Jianping and Khan, Latifur",1--10,2006,ACM,inproceedings,,,,
743,Viewpoints in object database systems,Joint proceedings of the second international software architecture workshop (ISAW-2) and international workshop on multiple perspectives in software development (Viewpoints' 96) on SIGSOFT'96 workshops,"Bertino, Elisa and Guerrini, Giovanna",289--293,1996,ACM,inproceedings,,,,
744,Reputation management in crowdsourcing systems,"Collaborative Computing: Networking, Applications and Worksharing (CollaborateCom), 2012 8th International Conference on","Allahbakhsh, Mohammad and Ignjatovic, Aleksandar and Benatallah, Boualem and Beheshti, Soosan and Bertino, Elisa and Foo, Norman",664--671,2012,IEEE,inproceedings,,,,
745,Publishing time-series data under preservation of privacy and distance orders,Database and Expert Systems Applications,"Moon, Yang-Sae and Kim, Hea-Suk and Kim, Sang-Pil and Bertino, Elisa",17--31,2010,,incollection,Springer Berlin Heidelberg,,,
746,An interoperable approach to multifactor identity verification,,"Paci, Federica and Ferrini, Rodolfo and Musci, Andrea and Steuer Jr, Kevin and Bertino, Elisa",50--57,2009,,article,IEEE,Computer,5,
747,Tagging stream data for rich real-time services,,"Nehme, Rimma V and Rundensteiner, Elke A and Bertino, Elisa",73--84,2009,,article,VLDB Endowment,Proceedings of the VLDB Endowment,1,2
748,Role based access control models,,"Bellettini, Carlo and Bertino, Elisa and Ferrari, Elena",21--29,2001,,article,Elsevier Advanced Technology,Information Security Technical Report,2,6
749,Towards optimal two-dimensional indexing for constraint databases,,"Bertino, Elisa and Catania, Barbara and Shidlovsky, Boris",1--8,1997,,article,Elsevier,Information Processing Letters,1,64
750,ARUBA: A risk-utility-based algorithm for data disclosure,Secure Data Management,"Fouad, Mohamed R and Lebanon, Guy and Bertino, Elisa",32--49,2008,,incollection,Springer Berlin Heidelberg,,,
751,Content-based filtering of Web documents: The MaX system and the EUFORBIA project,,"Bertino, Elisa and Ferrari, Elena and Perego, Andrea",45--58,2003,,article,Springer-Verlag,International Journal of Information Security,1,2
752,Navigational accesses in a temporal object model,,"Bertino, Elisa and Ferrari, Eiena and Guerrini, Giovanna",656--665,1998,,article,IEEE,"Knowledge and Data Engineering, IEEE Transactions on",4,10
753,Location-aware authentication and access control,2009 International Conference on Advanced Information Networking and Applications,"Bertino, Elisa and Kirkpatrick, Michael",10--15,2009,IEEE,inproceedings,,,,
754,Policy mapper: Administering location-based access-control policies,,"Bhatti, Rafae and Damiani, Maria Luisa and Bettis, David W and Bertino, Elisa",38--45,2008,,article,IEEE,"Internet Computing, IEEE",2,12
755,A reference framework for integrating multiple representations of geographical maps,Proceedings of the 11th ACM international symposium on Advances in geographic information systems,"Belussi, Alberto and Catania, Barbara and Bertino, Elisa",33--40,2003,ACM,inproceedings,,,,
756,Multifactor identity verification using aggregated proof of knowledge,,"Bhargav-Spantzel, Abhilasha and Squicciarini, Anna Cinzia and Xue, Rui and Bertino, Elisa",372--383,2010,,article,IEEE,"Systems, Man, and Cybernetics, Part C: Applications and Reviews, IEEE Transactions on",4,40
757,A policy-based authorization framework for web services: Integrating xgtrbac and ws-policy,"Web Services, 2007. ICWS 2007. IEEE International Conference on","Bhatti, Rafae and Sanz, Daniel and Bertino, Elisa and Ghafoor, Arif",447--454,2007,IEEE,inproceedings,,,,
758,An analytical model of object-oriented query costs,Persistent Object Systems,"Bertino, Elisa and Foscoli, Paola",241--261,1993,,incollection,Springer London,,,
759,Approach to supporting continuity of usage in location-based access control,"Future Trends of Distributed Computing Systems, 2008. FTDCS'08. 12th IEEE International Workshop on","Damiani, Maria Luisa and Bertino, Elisa and Silvestri, Claudio",199--205,2008,IEEE,inproceedings,,,,
760,Secure provenance transmission for streaming data,,"Sultana, Shabana and Shehab, Mohamed and Bertino, Elisa",1890--1903,2013,,article,IEEE,"Knowledge and Data Engineering, IEEE Transactions on",8,25
761,Attribute based group key management,,"Nabeel, Mohamed and Yoosuf, Mohamed and Bertino, Elisa",,2014,,article,,,,
762,Dissemination of cultural heritage content through virtual reality and multimedia techniques: a case study,"Multimedia Modelling Conference, 2005. MMM 2005. Proceedings of the 11th International","Valtolina, Stefano and Franzoni, Stefano and Mazzoleni, Pietro and Bertino, Elisa",214--221,2005,IEEE,inproceedings,,,,
763,Secure third party distribution of XML data,"Data Engineering, 2005. ICDE 2005. Proceedings. 21st International Conference on","Carminati, Barbara and Ferrari, Elena and Bertino, Elisa",547--548,2005,IEEE,inproceedings,,,,
764,Data protection from insider threats,,"Bertino, Elisa",1--91,2012,,article,Morgan \& Claypool Publishers,Synthesis Lectures on Data Management,4,4
765,Mask: a system for privacy-preserving policy-based access to published content,Proceedings of the 2010 ACM SIGMOD International Conference on Management of data,"Nabeel, Mohamed and Shang, Ning and Zage, John and Bertino, Elisa",1239--1242,2010,ACM,inproceedings,,,,
766,Efficient systematic clustering method for k-anonymization,,"Kabir, Md Enamul and Wang, Hua and Bertino, Elisa",51--66,2011,,article,Springer-Verlag,Acta Informatica,1,48
767,CiVeDi: a customized virtual environment for database interaction,,"Mazzoleni, Pietro and Bertino, Elisa and Ferrari, Elena and Valtolina, Stefano",15--20,2004,,article,ACM,ACM SIGMOD Record,3,33
768,Navigating through multiple temporal granularity objects,"Temporal Representation and Reasoning, 2001. TIME 2001. Proceedings. Eighth International Symposium on","Bertino, Elisa and Ferrari, Elena and Guerrini, Giovanna and Merlo, Isabella",147--155,2001,IEEE,inproceedings,,,,
769,An object-oriented approach to the interconnection of heterogenous databases,,"Bertino, E and Pelagatti, G and Sbattella, L",,1989,,article,,Proceedings of the Workshop on Heterogenous Databases. NSF,,
770,Object evolution in object databases,Dynamic Worlds,"Bertino, Elisa and Guerrini, Giovanna and Rusca, Luca",219--246,1999,,incollection,Springer Netherlands,,,
771,A system for securing push-based distribution of XML documents,,"Bertino, Elisa and Ferrari, Elena and Paci, Federica and Provenza, Loredana Parasiliti",255--284,2007,,article,Springer-Verlag,International Journal of Information Security,4,6
772,k-shares: A privacy preserving reputation protocol for decentralized environments,Security and Privacy--Silver Linings in the Cloud,"Hasan, Omar and Brunie, Lionel and Bertino, Elisa",253--264,2010,,incollection,Springer Berlin Heidelberg,,,
773,Adaptive management of multigranular spatio-temporal object attributes,Advances in Spatial and Temporal Databases,"Camossi, Elena and Bertino, Elisa and Guerrini, Giovanna and Bertolotto, Michela",320--337,2009,,incollection,Springer Berlin Heidelberg,,,
774,A secure publishing service for digital libraries of XML documents,Information Security,"Bertino, Elisa and Carminati, Barbara and Ferrari, Elena",347--362,2001,,incollection,Springer Berlin Heidelberg,,,
775,A policy-based accountability tool for grid computing systems,"Asia-Pacific Services Computing Conference, 2008. APSCC'08. IEEE","Squicciarini, Anna Cinzia and Lee, Wonjun and Bertino, Elisa and Song, Carol X",95--100,2008,IEEE,inproceedings,,,,
776,A multi-strategy approach to rating and filtering online resources,"Database and Expert Systems Applications, 2005. Proceedings. Sixteenth International Workshop on","Bertino, Elisa and Ferrari, Elena and Perego, Andrea and Zarri, Gian Piero",519--523,2005,IEEE,inproceedings,,,,
777,Systematic clustering method for l-diversity model,Proceedings of the Twenty-First Australasian Conference on Database Technologies-Volume 104,"Kabir, Md Enamul and Wang, Hua and Bertino, Elisa and Chi, Yunxiang",93--102,2010,"Australian Computer Society, Inc.",inproceedings,,,,
778,Matching an XML Document against a Set of DTDs,Foundations of Intelligent Systems,"Bertino, Elisa and Guerrini, Giovanna and Mesiti, Marco",412--422,2002,,incollection,Springer Berlin Heidelberg,,,
779,XACML function annotations,"Policies for Distributed Systems and Networks, 2007. POLICY'07. Eighth IEEE International Workshop on","Rao, Prathima and Lin, Dan and Bertino, Elisa",178--182,2007,IEEE,inproceedings,,,,
780,An update protocol for XML documents in distributed and cooperative systems,"Distributed Computing Systems, 2005. ICDCS 2005. Proceedings. 25th IEEE International Conference on","Koglin, Yunhua and Mella, Giovanni and Bertino, Elisa and Ferrari, Elena",314--323,2005,IEEE,inproceedings,,,,
781,Extending the ODMG object model with triggers,,"Bertino, Elisa and Guerrini, Giovanna and Merlo, Isabella",170--188,2004,,article,IEEE,"Knowledge and Data Engineering, IEEE Transactions on",2,16
782,Using spatial data access structures for filtering nearest neighbor queries,,"Belussi, Alberto and Bertino, Elisa and Catania, Barbara",1--31,2002,,article,Elsevier,Data \& Knowledge Engineering,1,40
783,Multi-route query processing and optimization,,"Nehme, Rimma V and Works, Karen and Lei, Chuan and Rundensteiner, Elke A and Bertino, Elisa",312--329,2013,,article,Academic Press,Journal of computer and system sciences,3,79
784,Collusion Detection in Online Rating Systems.,APWeb,"Allahbakhsh, Mohammad and Ignjatovic, Aleksandar and Benatallah, Boualem and Seyed-Mehdi-Reza Beheshti, Elisa Bertino and Bertino, Elisa and Foo, Norman",196--207,2013,,inproceedings,,,,
785,Rule termination analysis investigating the interaction between transactions and triggers,"Database Engineering and Applications Symposium, 2002. Proceedings. International","Montesi, Danilo and Bertino, Elisa and Bagnato, Maria and Dearnley, Peter",285--294,2002,IEEE,inproceedings,,,,
786,Trust-$\backslash$ mathcal $\{$X$\}$: An XML Framework for Trust Negotiations,Communications and Multimedia Security. Advanced Techniques for Network and Data Protection,"Bertino, Elisa and Ferrari, Elena and Squicciarini, Anna Cinzia",146--157,2003,,incollection,Springer Berlin Heidelberg,,,
787,End-to-end accountability in grid computing systems for coalition information sharing,Proceedings of the 4th annual workshop on Cyber security and information intelligence research: developing strategies to meet the cyber security and information intelligence challenges ahead,"Bertino, Elisa and Lee, Wonjun and Squicciarini, Anna C and Thuraisingham, Bhavani",29,2008,ACM,inproceedings,,,,
788,Replacing lost or stolen E-passports,,"Yong, Jianming and Bertino, Elisa",89--91,2007,,article,IEEE,Computer,10,40
789,PAtterns for Next-generation DAtabase systems: preliminary results of the PANDA project.,SEBD,"Bartolini, Ilaria and Bertino, Elisa and Catania, Barbara and Ciaccia, Paolo and Golfarelli, Matteo and Patella, Marco and Rizzi, Stefano",293--300,2003,,inproceedings,,,,
790,Digital identity protection-concepts and issues,,"Bertino, Elisa and Paci, Federica and Shang, Ning",69--78,2009,,article,,"4th International Conference on Availability, Reliability and Security, Fukuoka, Japan",,
791,An apples-to-apples comparison of two database journals,,"Bernstein, Philip A and Bertino, Elisa and Heuer, Andreas and Jensen, Christian S and Meyer, Holger and {\""O}zsu, M Tamer and Snodgrass, Richard T and Whang, Kyu-Young",61--64,2005,,article,ACM,ACM SIGMOD Record,4,34
792,Emerging trends around big data analytics and security: panel,Proceedings of the 17th ACM symposium on Access Control Models and Technologies,"Bhatti, Rafae and LaSalle, Ryan and Bird, Rob and Grance, Tim and Bertino, Elisa",67--68,2012,ACM,inproceedings,,,,
793,A privacy preserving assertion based policy language for federation systems,Proceedings of the 12th ACM symposium on Access control models and technologies,"Squicciarini, Anna C and Hintoglu, Ayca Azgin and Bertino, Elisa and Saygin, Yucel",51--60,2007,ACM,inproceedings,,,,
794,Multigranular spatio-temporal models: implementation challenges,Proceedings of the 16th ACM SIGSPATIAL international conference on Advances in geographic information systems,"Camossi, Elena and Bertolotto, Michela and Bertino, Elisa",63,2008,ACM,inproceedings,,,,
795,Fault tolerance and recovery in mobile computing systems,,"Bertino, Elisa and Pagani, Elena and Rossi, Gian Paolo",,1997,,article,,Recovery Mechanisms in Database Systems (Eds. V. Kumar and M. Hsu). Prentice-Hall,,
796,A distributed approach to enabling privacy-preserving model-based classifier training,,"Luo, Hangzai and Fan, Jianping and Lin, Xiaodong and Zhou, Aoying and Bertino, Elisa",157--185,2009,,article,Springer-Verlag,Knowledge and information systems,2,20
797,Integrity aspects in database management systems,,"Bertino, E and Apuzzo, D",,,,article,,"Proc. IEEE Trends and Applications Conference, Making Database Work,(43 $\{$52)}, year={1984",,
798,Integrated document and knowledge management for the knowledge-based enterprise,,"McNaught, J and Black, W and Rinaldi, F and Bertino, E and Brasher, A and Deavin, D and Catania, B and Silvestri, D and Armani, B and Persidis, A and others",,2000,,article,Citeseer,Proceedings of the 3rd International Conference on the practical application of Knowledge Management,,
799,Repository management in an intelligent indexing approach for multimedia digital libraries,,"Armani, B and Catania, B and Bertino, E and Laradi, D and Marin, B and Zarri, Gian Piero",431--440,2010,,article,Springer Berlin/Heidelberg,Foundations of Intelligent Systems,,
800,Finitely representable nested relations,,"Bertino, Elisa and Catania, Barbara and Wong, Limsoon",165--173,1999,,article,Elsevier,Information Processing Letters,4,70
801,Privacy preserving olap over distributed xml data: A theoretically-sound secure-multiparty-computation approach,,"Cuzzocrea, Alfredo and Bertino, Elisa",965--987,2011,,article,Academic Press,Journal of Computer and System Sciences,6,77
802,Secure delta-publishing of XML content,"Data Engineering, 2008. ICDE 2008. IEEE 24th International Conference on","Nabeel, Mohamed and Bertino, Elisa",1361--1363,2008,IEEE,inproceedings,,,,
803,Trustworthy information: concepts and mechanisms,Web-Age Information Management,"Xu, Shouhuai and Qian, Haifeng and Wang, Fengying and Zhan, Zhenxin and Bertino, Elisa and Sandhu, Ravi",398--404,2010,,incollection,Springer Berlin Heidelberg,,,
804,Secure knn query processing in untrusted cloud environments,,"Choi, Sunoh and Ghinita, Gabriel and Lim, Hyo-Sang and Bertino, Elisa",2818--2831,2014,,article,IEEE,"Knowledge and Data Engineering, IEEE Transactions on",11,26
805,A general framework for web content filtering,,"Bertino, Elisa and Ferrari, Elena and Perego, Andrea",215--249,2010,,article,Springer US,World Wide Web,3,13
