ID,title,booktitle,author,pages,year,organization,ENTRYTYPE,publisher,journal,number,volume
2370,Agreement-based learning,Advances in Neural Information Processing Systems,"Liang, Percy and Klein, Dan and Jordan, Michael I",913--920,2007,,inproceedings,,,,
2371,Variational Bayesian inference with stochastic search,,"Paisley, John and Blei, David and Jordan, Michael",,2012,,article,,arXiv preprint arXiv:1206.6430,,
2372,Variational mcmc,Proceedings of the Seventeenth conference on Uncertainty in artificial intelligence,"De Freitas, Nando and H{\o}jen-S{\o}rensen, Pedro and Jordan, Michael I and Russell, Stuart",120--127,2001,Morgan Kaufmann Publishers Inc.,inproceedings,,,,
2373,Sparse Gaussian process classification with multiple classes,,"Seeger, Matthias and Jordan, Michael",,2004,,techreport,,,,
2374,Log-determinant relaxation for approximate inference in discrete Markov random fields,,"Wainwright, Martin J and Jordan, Michael and others",2099--2109,2006,,article,IEEE,"Signal Processing, IEEE Transactions on",6,54
2375,Multiway spectral clustering: A margin-based perspective,,"Zhang, Zhihua and Jordan, Michael I and others",383--403,2008,,article,Institute of Mathematical Statistics,Statistical Science,3,23
2376,A unified probabilistic model for global and local unsupervised feature selection,Proceedings of the 28th International Conference on Machine Learning (ICML-11),"Guan, Yue and Jordan, Michael I and Dy, Jennifer G",1073--1080,2011,,inproceedings,,,,
2377,Direct discriminative pattern mining for effective classification,"Data Engineering, 2008. ICDE 2008. IEEE 24th International Conference on","Cheng, Hong and Yan, Xifeng and Han, Jiawei and Yu, Philip S",169--178,2008,IEEE,inproceedings,,,,
2378,Outlier detection for high dimensional data,ACM Sigmod Record,"Aggarwal, Charu C and Yu, Philip S",37--46,2001,ACM,inproceedings,,,2,30
2379,Top-down specialization for information and privacy preservation,"Data Engineering, 2005. ICDE 2005. Proceedings. 21st International Conference on","Fung, Benjamin and Wang, Ke and Yu, Philip S",205--216,2005,IEEE,inproceedings,,,,
2380,Design and analysis of a grouped sweeping scheme for multimedia storage management,Network and Operating System Support for Digital Audio and Video,"Philip, S Yu and Chen, Mon-Song and Kandlur, Dilip D",40--55,1993,,incollection,Springer Berlin Heidelberg,,,
2381,Load balancing cooperating cache servers by shifting forwarded request,,"Jordan, Kevin Michael and Wu, Kun-Lung and Yu, Philip Shi-lung",,2002,,misc,,,,
2382,Segment-based proxy caching of multimedia streams,Proceedings of the 10th international conference on World Wide Web,"Wu, Kun-Lung and Yu, Philip S and Wolf, Joel L",36--44,2001,ACM,inproceedings,,,,
2383,Privacy-preserving data publishing: A survey of recent developments,,"Fung, Benjamin and Wang, Ke and Chen, Rui and Yu, Philip S",14,2010,,article,ACM,ACM Computing Surveys (CSUR),4,42
2384,Caching on the world wide web,,"Aggarwal, Charu and Wolf, Joel L and Yu, Philip S",94--107,1999,,article,IEEE,"Knowledge and Data Engineering, IEEE Transactions on",1,11
2385,Online generation of association rules,"Data Engineering, 1998. Proceedings., 14th International Conference on","Aggarwal, Charu C and Yu, Philip S",402--411,1998,IEEE,inproceedings,,,,
2386,Using a hash-based method with transaction trimming for mining association rules,,"Park, Jong Soo and Chen, Ming-Syan and Yu, Philip S",813--825,1997,,article,IEEE,"Knowledge and Data Engineering, IEEE Transactions on",5,9
2387,Crossmine: Efficient classification across multiple database relations,Constraint-Based mining and inductive databases,"Yin, Xiaoxin and Han, Jiawei and Yang, Jiong and Philip, S Yu",172--195,2006,,incollection,Springer Berlin Heidelberg,,,
2388,Fast algorithms for projected clustering,ACM SIGMoD Record,"Aggarwal, Charu C and Wolf, Joel L and Yu, Philip S and Procopiuc, Cecilia and Park, Jong Soo",61--72,1999,ACM,inproceedings,,,2,28
2389,Look-ahead scheduling to support video-on-demand applications,,"Wolf, Joel L and Philip, S Yu",,1995,,misc,,,,
2390,A new method to measure the semantic similarity of GO terms,,"Wang, James Z and Du, Zhidian and Payattakool, Rapeeporn and Philip, S Yu and Chen, Chin-Fu",1274--1281,2007,,article,Oxford Univ Press,Bioinformatics,10,23
2391,Efficient parallel data mining for association rules,Proceedings of the fourth international conference on Information and knowledge management,"Park, Jong Soo and Chen, Ming-Syan and Yu, Philip S",31--36,1995,ACM,inproceedings,,,,
2392,Spectral clustering for multi-type relational data,Proceedings of the 23rd international conference on Machine learning,"Long, Bo and Zhang, Zhongfei Mark and Wu, Xiaoyun and Yu, Philip S",585--592,2006,ACM,inproceedings,,,,
2393,Truth discovery with multiple conflicting information providers on the web,,"Yin, Xiaoxin and Han, Jiawei and Yu, Philip S",796--808,2008,,article,IEEE,"Knowledge and Data Engineering, IEEE Transactions on",6,20
2394,On optimal piggyback merging policies for video-on-demand systems,ACM SIGMETRICS Performance Evaluation Review,"Aggarwal, Charu and Wolf, Joel and Yu, Philip S",200--209,1996,ACM,inproceedings,,,1,24
2395,Apparatus and method for dynamic meta-tagging of compound documents,,"Hailpern, Brent Tzion and Malkin, Peter Kenneth and Schloss, Robert Jeffrey and Yu, Philip Shi-lung",,2000,,misc,,,,
2396,Identifying the influential bloggers in a community,Proceedings of the 2008 international conference on web search and data mining,"Agarwal, Nitin and Liu, Huan and Tang, Lei and Yu, Philip S",207--218,2008,ACM,inproceedings,,,,
2397,Content based method for product-peer filtering,,"Aggarwal, Charu C and Philip, S Yu",,2002,,misc,,,,
2398,Clustering through decision tree construction,Proceedings of the ninth international conference on Information and knowledge management,"Liu, Bing and Xia, Yiyuan and Yu, Philip S",20--29,2000,ACM,inproceedings,,,,
2399,Finding generalized projected clusters in high dimensional spaces,ACM SIGMOD Record,"Aggarwal, Charu C and Yu, Philip S",70--81,2000,ACM,inproceedings,,,2,29
2400,Optimization of the grouped sweeping scheduling (GSS) with heterogeneous multimedia streams,Proceedings of the first ACM international conference on Multimedia,"Chen, Mon-Song and Kandlur, Dilip D and Yu, Philip S",235--242,1993,ACM,inproceedings,,,,
2401,Clustering by pattern similarity in large data sets,Proceedings of the 2002 ACM SIGMOD international conference on Management of data,"Wang, Haixun and Wang, Wei and Yang, Jiong and Yu, Philip S",394--405,2002,ACM,inproceedings,,,,
2402,An effective and efficient algorithm for high-dimensional outlier detection,,"Aggarwal, Charu and Yu, S",211--221,2005,,article,"Springer-Verlag New York, Inc.",The VLDB Journal—The International Journal on Very Large Data Bases,2,14
2403,SPADE: the system s declarative stream processing engine,Proceedings of the 2008 ACM SIGMOD international conference on Management of data,"Gedik, Bugra and Andrade, Henrique and Wu, Kun-Lung and Yu, Philip S and Doo, Myungcheol",1123--1134,2008,ACM,inproceedings,,,,
2404,Mining asynchronous periodic patterns in time series data,,"Yang, Jiong and Wang, Wei and Yu, Philip S",613--628,2003,,article,IEEE,"Knowledge and Data Engineering, IEEE Transactions on",3,15
2405,A permutation-based pyramid broadcasting scheme for video-on-demand systems,"Multimedia Computing and Systems, 1996., Proceedings of the Third IEEE International Conference on","Aggarwal, Cham C and Wolf, Joel L and Yu, Philip S",118--126,1996,IEEE,inproceedings,,,,
2406,A condensation approach to privacy preserving data mining,Advances in Database Technology-EDBT 2004,"Aggarwal, Charu C and Philip, S Yu",183--199,2004,,incollection,Springer Berlin Heidelberg,,,
2407,Privacy-preserving data mining: models and algorithms,,"Aggarwal, Charu C and Philip, S Yu",,2008,,book,Springer-Verlag New York Inc,,,34
2408,A framework for projected clustering of high dimensional data streams,Proceedings of the Thirtieth international conference on Very large data bases-Volume 30,"Aggarwal, Charu C and Han, Jiawei and Wang, Jianyong and Yu, Philip S",852--863,2004,VLDB Endowment,inproceedings,,,,
2409,Pathsim: Meta path-based top-k similarity search in heterogeneous information networks,,"Sun, Yizhou and Han, Jiawei and Yan, Xifeng and Yu, Philip S and Wu, Tianyi",,2011,,article,,VLDB’11,,
2410,ViST: a dynamic index method for querying XML data by tree structures,Proceedings of the 2003 ACM SIGMOD international conference on Management of data,"Wang, Haixun and Park, Sanghyun and Fan, Wei and Yu, Philip S",110--121,2003,ACM,inproceedings,,,,
2411,Top 10 algorithms in data mining,,"Wu, Xindong and Kumar, Vipin and Quinlan, J Ross and Ghosh, Joydeep and Yang, Qiang and Motoda, Hiroshi and McLachlan, Geoffrey J and Ng, Angus and Liu, Bing and Philip, S Yu and others",1--37,2008,,article,Springer-Verlag,Knowledge and Information Systems,1,14
2412,Dynamic load balancing on web-server systems,,"Cardellini, Valeria and Colajanni, Michele and Philip, S Yu",28--39,1999,,article,IEEE,IEEE Internet computing,3,
2413,Data mining for path traversal patterns in a web environment,"Distributed Computing Systems, 1996., Proceedings of the 16th International Conference on","Chen, Ming Syan and Park, Jong Soo and Yu, Philip S",385--392,1996,IEEE,inproceedings,,,,
2414,A holistic lexicon-based approach to opinion mining,Proceedings of the 2008 International Conference on Web Search and Data Mining,"Ding, Xiaowen and Liu, Bing and Yu, Philip S",231--240,2008,ACM,inproceedings,,,,
2415,Anonymizing transaction databases for publication,Proceedings of the 14th ACM SIGKDD international conference on Knowledge discovery and data mining,"Xu, Yabo and Wang, Ke and Fu, Ada Wai-Chee and Yu, Philip S",767--775,2008,ACM,inproceedings,,,,
2416,Building text classifiers using positive and unlabeled examples,"Data Mining, 2003. ICDM 2003. Third IEEE International Conference on","Liu, Bing and Dai, Yang and Li, Xiaoli and Lee, Wee Sun and Yu, Philip S",179--186,2003,IEEE,inproceedings,,,,
2417,Loading balancing across servers in a computer network,,"Yu, Philip Shi-lung",,2002,,misc,,,,
2418,Graphscope: parameter-free mining of large time-evolving graphs,Proceedings of the 13th ACM SIGKDD international conference on Knowledge discovery and data mining,"Sun, Jimeng and Faloutsos, Christos and Papadimitriou, Spiros and Yu, Philip S",687--696,2007,ACM,inproceedings,,,,
2419,$\delta$-clusters: Capturing subspace correlation in a large data set,"Data Engineering, 2002. Proceedings. 18th International Conference on","Yang, Jiong and Wang, Wei and Wang, Haixun and Yu, Philip",517--528,2002,IEEE,inproceedings,,,,
2420,Optimal crawling strategies for web search engines,Proceedings of the 11th international conference on World Wide Web,"Wolf, Joel L and Squillante, Mark S and Yu, PS and Sethuraman, Jay and Ozsen, Leyla",136--147,2002,ACM,inproceedings,,,,
2421,A framework for clustering uncertain data streams,"Data Engineering, 2008. ICDE 2008. IEEE 24th International Conference on","Aggarwal, Charu C and Yu, Philip S",150--159,2008,IEEE,inproceedings,,,,
2422,Method and system for dynamically prefetching information via a server hierarchy,,"Malkin, Peter Kenneth and Yu, Philip Shi-lung",,2000,,misc,,,,
2423,Mining frequent patterns in data streams at multiple time granularities,,"Giannella, Chris and Han, Jiawei and Pei, Jian and Yan, Xifeng and Yu, Philip S",191--212,2003,,article,AAAI/MIT,Next generation data mining,,212
2424,Online mining of changes from data streams: Research problems and preliminary results,,"Dong, Guozhu and Han, Jiawei and Lakshmanan, Laks VS and Pei, Jian and Wang, Haixun and Yu, Philip S",739--747,2003,,article,,Proceedings of the 2003 ACM SIGMOD Workshop on Management and Processing of Data Streams,,
2425,Energy-efficient caching for wireless mobile computing,"Data Engineering, 1996. Proceedings of the Twelfth International Conference on","Wu, Kun-Lung and Yu, Philip S and Chen, Ming-Syan",336--343,1996,IEEE,inproceedings,,,,
2426,Enhanced biclustering on expression data,"Bioinformatics and Bioengineering, 2003. Proceedings. Third IEEE Symposium on","Yang, Jiong and Wang, Haixun and Wang, Wei and Yu, Philip",321--327,2003,IEEE,inproceedings,,,,
2427,Efficient data mining for path traversal patterns,,"Chen, Ming-Syan and Park, Jong Soo and Yu, Philip S",209--221,1998,,article,IEEE,"Knowledge and Data Engineering, IEEE Transactions on",2,10
2428,System and method of multiparty billing for Web access,,"Crosskey, James P and Mei, Mark Gee-Gwo and Ragavan, Harish and Wu, Kun-Lung and Yu, Philip Shi-lung",,2000,,misc,,,,
2429,A regression-based temporal pattern mining scheme for data streams,Proceedings of the 29th international conference on Very large data bases-Volume 29,"Teng, Wei-Guang and Chen, Ming-Syan and Yu, Philip S",93--104,2003,VLDB Endowment,inproceedings,,,,
2430,Graph indexing: a frequent structure-based approach,Proceedings of the 2004 ACM SIGMOD international conference on Management of data,"Yan, Xifeng and Yu, Philip S and Han, Jiawei",335--346,2004,ACM,inproceedings,,,,
2431,LinkClus: efficient clustering via heterogeneous semantic links,Proceedings of the 32nd international conference on Very large data bases,"Yin, Xiaoxin and Han, Jiawei and Yu, Philip S",427--438,2006,VLDB Endowment,inproceedings,,,,
2432,Collaborative caching of a requested object by a lower level node as a function of the caching status of the object at a higher level node,,"Aggarwal, Charu Chandra and Malkin, Peter Kenneth and Schloss, Robert Jeffrey and Yu, Philip Shi-lung",,1999,,misc,,,,
2433,Computer system and method for load balancing with selective control,,"Dias, Daniel Manuel and Wolf, Joel Leonard and Yu, Philip Shi-lung",,2000,,misc,,,,
2434,Intelligent crawling on the World Wide Web with arbitrary predicates,Proceedings of the 10th international conference on World Wide Web,"Aggarwal, Charu C and Al-Garawi, Fatima and Yu, Philip S",96--105,2001,ACM,inproceedings,,,,
2435,Grouped sweeping scheduling for DASD-based multimedia storage management,,"Philip, S Yu and Chen, Mon-Song and Kandlur, Dilip D",99--109,1993,,article,Springer-Verlag,Multimedia Systems,3,1
2436,ASAP: an adaptive sampling approach to data collection in sensor networks,,"Gedik, Bu{\u{g}}ra and Liu, Ling and Yu, Philip S",1766--1783,2007,,article,IEEE,"Parallel and Distributed Systems, IEEE Transactions on",12,18
2437,Multilevel locking system and method,,"Dias, Daniel M and Iyer, Balakrishna R and Philip, S Yu",,1992,,misc,,,,
2438,Cross-feature analysis for detecting ad-hoc routing anomalies,"Distributed Computing Systems, 2003. Proceedings. 23rd International Conference on","Huang, Yi-an and Fan, Wei and Lee, Wenke and Yu, Philip S",478--487,2003,IEEE,inproceedings,,,,
2439,Anonymizing classification data for privacy preservation,,"Fung, Benjamin and Wang, Ke and Yu, Philip S",711--725,2007,,article,IEEE,"Knowledge and Data Engineering, IEEE Transactions on",5,19
2440,Analysis of task assignment policies in scalable distributed Web-server systems,,"Colajanni, Michele and Yu, Philip S and Dias, Daniel M",585--600,1998,,article,IEEE,"Parallel and Distributed Systems, IEEE Transactions on",6,9
2441,Substructure similarity search in graph databases,Proceedings of the 2005 ACM SIGMOD international conference on Management of data,"Yan, Xifeng and Yu, Philip S and Han, Jiawei",766--777,2005,ACM,inproceedings,,,,
2442,Bottom-up generalization: A data mining solution to privacy protection,"Data Mining, 2004. ICDM'04. Fourth IEEE International Conference on","Wang, Ke and Yu, Philip S and Chakraborty, Sourav",249--256,2004,IEEE,inproceedings,,,,
2443,System and method for construction of a data structure for indexing multidimensional objects,,"Aggarwal, Charu Chandra and Wolf, Joel Leonard and Yu, Philip Shi-lung",,1998,,misc,,,,
2444,On demand classification of data streams,Proceedings of the tenth ACM SIGKDD international conference on Knowledge discovery and data mining,"Aggarwal, Charu C and Han, Jiawei and Wang, Jianyong and Yu, Philip S",503--508,2004,ACM,inproceedings,,,,
2445,On the merits of building categorization systems by supervised clustering,Proceedings of the fifth ACM SIGKDD international conference on Knowledge discovery and data mining,"Aggarwal, Charu C and Gates, Stephen C and Yu, Philip S",352--356,1999,ACM,inproceedings,,,,
2446,Task scheduler for a miltiprocessor system,,"Wolf, Joel L and Philip, S Yu and Turek, John JE",,1995,,misc,,,,
2447,Support for fully interactive playout in disk-array-based video server,Proceedings of the second ACM international conference on Multimedia,"Chen, M-S and Kandlur, Dilip and Yu, Ph",391--398,1994,ACM,inproceedings,,,,
2448,On real-time databases: Concurrency control and scheduling,,"Yu, Philip S and Wu, Kun-Lung and Lin, Kwei-Jay and Son, Sang H",140--157,1994,,article,IEEE,Proceedings of the IEEE,1,82
2449,An effective hash-based algorithm for mining association rules,ACM SIGMOD Record,"Park, Jong Soo and Chen, Ming-Syan and Yu, Philip S",175--186,1995,ACM,inproceedings,,,2,24
2450,Mining long sequential patterns in a noisy environment,Proceedings of the 2002 ACM SIGMOD international conference on Management of data,"Yang, Jiong and Wang, Wei and Yu, Philip S and Han, Jiawei",406--417,2002,ACM,inproceedings,,,,
2451,A hybrid ARQ scheme with parity retransmission for error control of satellite channels,,"Lin, Shu and Yu, PS",1701--1719,1982,,article,IEEE,"Communications, IEEE Transactions on",7,30
2452,Dynamic load balancing in geographically distributed heterogeneous web servers,"Distributed Computing Systems, 1998. Proceedings. 18th International Conference on","Colajanni, Michele and Yu, Philip S and Cardellini, Valeria",295--302,1998,IEEE,inproceedings,,,,
2453,A framework for clustering evolving data streams,Proceedings of the 29th international conference on Very large data bases-Volume 29,"Aggarwal, Charu C and Han, Jiawei and Wang, Jianyong and Yu, Philip S",81--92,2003,VLDB Endowment,inproceedings,,,,
2454,Text classification by labeling words,,"Liu, Bing and Li, Xiaoli and Lee, Wee Sun and Yu, Philip S",425--430,2004,,article,,AAAI,,4
2455,A new framework for itemset generation,Proceedings of the seventeenth ACM SIGACT-SIGMOD-SIGART symposium on Principles of database systems,"Aggarwal, Charu C and Yu, Philip S",18--24,1998,ACM,inproceedings,,,,
2456,Utility computing SLA management based upon business objectives,,"Buco, Melissa J and Chang, Rong N and Luan, Laura Z and Ward, Christopher and Wolf, Joel L and Yu, Philip S",159--178,2004,,article,IBM,IBM Systems Journal,1,43
2457,Optimizing index allocation for sequential data broadcasting in wireless mobile computing,,"Chen, Ming-Syan and Wu, Kun-Lung and Yu, Philip S",161--173,2003,,article,IEEE,"Knowledge and Data Engineering, IEEE Transactions on",1,15
2458,Efficient mining of weighted association rules (WAR),Proceedings of the sixth ACM SIGKDD international conference on Knowledge discovery and data mining,"Wang, Wei and Yang, Jiong and Yu, Philip S",270--274,2000,ACM,inproceedings,,,,
2459,Partially supervised classification of text documents,,"Liu, Bing and Lee, Wee Sun and Yu, Philip S. and Li, Xiaoli",387--394,2002,,article,,ICML,,2
2460,Speedtracer: A web usage mining and analysis tool,,"Wu, K-L and Yu, Philip S. and Ballman, Allen",89--105,1998,,article,IBM,IBM Systems Journal,1,37
2461,Horting hatches an egg: A new graph-theoretic approach to collaborative filtering,Proceedings of the fifth ACM SIGKDD international conference on Knowledge discovery and data mining,"Aggarwal, Charu C and Wolf, Joel L and Wu, Kun-Lung and Yu, Philip S",201--212,1999,ACM,inproceedings,,,,
2462,Approximate algorithms scheduling parallelizable tasks,Proceedings of the fourth annual ACM symposium on Parallel algorithms and architectures,"Turek, John and Wolf, Joel L and Yu, Philip S",323--332,1992,ACM,inproceedings,,,,
2463,A survey of uncertain data algorithms and applications,,"Aggarwal, Charu C and Yu, Philip S",609--623,2009,,article,IEEE,"Knowledge and Data Engineering, IEEE Transactions on",5,21
2464,Sender-specified delivery customization,,"Malkin, Peter Kenneth and Yu, Philip Shi-lung",,2003,,misc,,,,
2465,BLINKS: ranked keyword searches on graphs,Proceedings of the 2007 ACM SIGMOD international conference on Management of data,"He, Hao and Wang, Haixun and Yang, Jun and Yu, Philip S",305--316,2007,ACM,inproceedings,,,,
2466,GPLAG: detection of software plagiarism by program dependence graph analysis,Proceedings of the 12th ACM SIGKDD international conference on Knowledge discovery and data mining,"Liu, Chao and Chen, Chen and Han, Jiawei and Yu, Philip S",872--881,2006,ACM,inproceedings,,,,
2467,Moment: Maintaining closed frequent itemsets over a stream sliding window,"Data Mining, 2004. ICDM'04. Fourth IEEE International Conference on","Chi, Yun and Wang, Haixun and Yu, Philip S and Muntz, Richard R",59--66,2004,IEEE,inproceedings,,,,
2468,The state of the art in locally distributed Web-server systems,,"Cardellini, Valeria and Casalicchio, Emiliano and Colajanni, Michele and Yu, Philip S",263--311,2002,,article,ACM,ACM Computing Surveys (CSUR),2,34
2469,Mining significant graph patterns by leap search,Proceedings of the 2008 ACM SIGMOD international conference on Management of data,"Yan, Xifeng and Cheng, Hong and Han, Jiawei and Yu, Philip S",433--444,2008,ACM,inproceedings,,,,
2470,Range-based bitmap indexing for high cardinality attributes with skew,"Computer Software and Applications Conference, 1998. COMPSAC'98. Proceedings. The Twenty-Second Annual International","Wu, Kun-Lung and Yu, Philip S",61--66,1998,IEEE,inproceedings,,,,
2471,A new method for similarity indexing of market basket data,ACM SIGMOD Record,"Aggarwal, Charu C and Wolf, Joel L and Yu, Philip S",407--418,1999,ACM,inproceedings,,,2,28
2472,UP-Growth: an efficient algorithm for high utility itemset mining,Proceedings of the 16th ACM SIGKDD international conference on Knowledge discovery and data mining,"Tseng, Vincent S and Wu, Cheng-Wei and Shie, Bai-En and Yu, Philip S",253--262,2010,ACM,inproceedings,,,,
2473,Global distance-based segmentation of trajectories,Proceedings of the 12th ACM SIGKDD international conference on Knowledge discovery and data mining,"Anagnostopoulos, Aris and Vlachos, Michail and Hadjieleftheriou, Marios and Keogh, Eamonn and Yu, Philip S",34--43,2006,ACM,inproceedings,,,,
2474,Redefining clustering for high-dimensional applications,,"Aggarwal, Charu C and Yu, Philip S",210--225,2002,,article,IEEE,"Knowledge and Data Engineering, IEEE Transactions on",2,14
2475,Finding localized associations in market basket data,,"Aggarwal, Charu C and Procopiuc, Cecilia and Yu, Philp S",51--62,2002,,article,IEEE,"Knowledge and Data Engineering, IEEE Transactions on",1,14
2476,Collaborative server processing of content and meta-information with application to virus checking in a server network,,"Hailpern, Brent Tzion and Malkin, Peter Kenneth and Schloss, Robert Jeffrey and White, Steve R and Yu, Philip Shi-lung and Palmer, Charles Campbell",,2001,,misc,,,,
2477,Dynamic customized web tours,,"Manohar, Nelson R and Willebeek-LeMair, Marc Hubert and Yu, Philip Shi-lung",,2003,,misc,,,,
2478,Template-based privacy preservation in classification problems,"Data Mining, Fifth IEEE International Conference on","Wang, Ke and Fung, Benjamin and Yu, Philip S",8--pp,2005,IEEE,inproceedings,,,,
2479,Active Mining of Data Streams.,SDM,"Fan, Wei and Huang, Yi-an and Wang, Haixun and Philip, S Yu",457--461,2004,,inproceedings,,,,
2480,"Mining Behavior Graphs for"" Backtrace"" of Noncrashing Bugs.",SDM,"Liu, Chao and Yan, Xifeng and Yu, Hwanjo and Han, Jiawei and Philip, S Yu",286--297,2005,,inproceedings,,,,
2481,A new approach to online generation of association rules,,"Aggarwal, Charu C and Yu, Philip S",527--540,2001,,article,IEEE,"Knowledge and Data Engineering, IEEE Transactions on",4,13
2482,Disk load balancing for video-on-demand systems,,"Wolf, Joel L and Philip, S Yu and Shachnai, Hadas",358--370,1997,,article,Springer-Verlag,Multimedia Systems,6,5
2483,Clustering algorithms for content-based publication-subscription systems,"Distributed Computing Systems, 2002. Proceedings. 22nd International Conference on","Riabov, Anton and Liu, Zhen and Wolf, Joel L and Yu, Philip S and Zhang, Li",133--142,2002,IEEE,inproceedings,,,,
2484,Semantic based collaborative filtering,,"Aggarwal, Charu C and Philip, S Yu",,2002,,misc,,,,
2485,A graph-based approach to systematically reconstruct human transcriptional regulatory modules,,"Yan, Xifeng and Mehan, Michael R and Huang, Yu and Waterman, Michael S and Philip, S Yu and Zhou, Xianghong Jasmine",i577--i586,2007,,article,Oxford University Press,Bioinformatics,13,23
2486,Frame sampling scheme for video scanning in a video-on-demand system,,"Chen, Ming-Syan and Kandlur, Dilip D and Philip, S Yu",,1996,,misc,,,,
2487,Challenges and experience in prototyping a multi-modal stream analytic and monitoring application on System S,Proceedings of the 33rd international conference on Very large data bases,"Wu, Kun-Lung and Hildrum, Kirsten W and Fan, Wei and Yu, Philip S and Aggarwal, Charu C and George, David A and Gedik, Buǧra and Bouillet, Eric and Gu, Xiaohui and Luo, Gang and others",1185--1196,2007,VLDB Endowment,inproceedings,,,,
2488,Redirection algorithms for load sharing in distributed Web-server systems,"Distributed Computing Systems, 1999. Proceedings. 19th IEEE International Conference on","Cardellini, Valeria and Colajanni, Michele and Yu, Philip S",528--535,1999,IEEE,inproceedings,,,,
