ID,title,booktitle,author,pages,year,organization,ENTRYTYPE,publisher,journal,number,volume
1,An interactive clustering-based approach to integrating source query interfaces on the deep web,Proceedings of the 2004 ACM SIGMOD international conference on Management of data,"Wu, Wensheng and Yu, Clement and Doan, AnHai and Meng, Weiyi",95--106,2004,ACM,inproceedings,,,,
2,Abstraction for Decision-Theoretic Planning,,"Doan, AnHai and Haddawy, Peter",,1995,,book,unpublished,,,
3,Introduction to the special issue on managing information extraction,,"Doan, AnHai and Gravano, Luis and Ramakrishnan, Raghu and Vaithyanathan, Shivakumar",5,2008,,article,,ACM Sigmod Record,4,37
4,"Building structured web community portals: A top-down, compositional, and incremental approach",Proceedings of the 33rd international conference on Very large data bases,"DeRose, Pedro and Shen, Warren and Chen, Fei and Doan, AnHai and Ramakrishnan, Raghu",399--410,2007,VLDB Endowment,inproceedings,,,,
5,Principles of data integration,,"Doan, AnHai and Halevy, Alon and Ives, Zachary",,2012,,book,Elsevier,,,
6,Webiq: Learning from the web to match deep-web query interfaces,"Data Engineering, 2006. ICDE'06. Proceedings of the 22nd International Conference on","Wu, Wensheng and Doan, AnHai and Yu, Clement",44--44,2006,IEEE,inproceedings,,,,
7,The Claremont report on database research,,"Agrawal, Rakesh and Ailamaki, Anastasia and Bernstein, Philip A and Brewer, Eric A and Carey, Michael J and Chaudhuri, Surajit and Doan, Anhai and Florescu, Daniela and Franklin, Michael J and Garcia-Molina, Hector and others",56--65,2009,,article,ACM,Communications of the ACM,6,52
8,Corpus-based schema matching,"Data Engineering, 2005. ICDE 2005. Proceedings. 21st International Conference on","Madhavan, Jayant and Bernstein, Philip and Doan, AnHai and Halevy, Alon and others",57--68,2005,IEEE,inproceedings,,,,
9,Combining keyword search and forms for ad hoc querying of databases,Proceedings of the 2009 ACM SIGMOD International Conference on Management of data,"Chu, Eric and Baid, Akanksha and Chai, Xiaoyong and Doan, AnHai and Naughton, Jeffrey",349--360,2009,ACM,inproceedings,,,,
10,Semantic integration,,"Noy, Natalya F and Doan, AnHai and Halevy, Alon Y",7,2005,,article,,AI Magazine,1,26
11,Mining for Information Discovery on the Web: Overview and Illustrative Research,Intelligent Technologies for Information Analysis,"Yu, Hwanjo and Doan, AnHai and Han, Jiawei",135--168,2004,,incollection,Springer Berlin Heidelberg,,,
12,Optimizing complex extraction programs over evolving text data,Proceedings of the 2009 ACM SIGMOD International Conference on Management of data,"Chen, Fei and Gao, Byron J and Doan, AnHai and Yang, Jun and Ramakrishnan, Raghu",321--334,2009,ACM,inproceedings,,,,
13,"Entity extraction, linking, classification, and tagging for social media: a wikipedia-based approach",,"Gattani, Abhishek and Lamba, Digvijay S and Garera, Nikesh and Tiwari, Mitul and Chai, Xiaoyong and Das, Sanjib and Subramaniam, Sri and Rajaraman, Anand and Harinarayan, Venky and Doan, AnHai",1126--1137,2013,,article,VLDB Endowment,Proceedings of the VLDB Endowment,11,6
14,Efficient information extraction over evolving text data,"Data Engineering, 2008. ICDE 2008. IEEE 24th International Conference on","Chen, Fei and Doan, AnHai and Yang, Jun and Ramakrishnan, Raghu",943--952,2008,IEEE,inproceedings,,,,
15,Building data integration systems via mass collaboration,,"McCann, Robert and Doan, AnHai and Varadarajan, Vanitha and Kramnik, Alexander",,2003,,article,,"Intl. Workshop on the Web and Databases, USA",,
16,The beckman report on database research,,"Abadi, Daniel and Agrawal, Rakesh and Ailamaki, Anastasia and Balazinska, Magdalena and Bernstein, Philip A and Carey, Michael J and Chaudhuri, Surajit and Dean, Jeffrey and Doan, AnHai and Franklin, Michael J and others",61--70,2014,,article,ACM,ACM SIGMOD Record,3,43
17,Source-aware entity matching: a compositional approach,"Data Engineering, 2007. ICDE 2007. IEEE 23rd International Conference on","Shen, Wei and DeRose, Pedro and Vu, Long and Doan, AnHai and Ramakrishnan, Raghu",196--205,2007,IEEE,inproceedings,,,,
18,Ontology matching: A machine learning approach,Handbook on ontologies,"Doan, AnHai and Madhavan, Jayant and Domingos, Pedro and Halevy, Alon",385--403,2004,,incollection,Springer Berlin Heidelberg,,,
19,Modeling Probabilistic Actions for Practical Decision-Theoretic Planning.,AIPS,"Doan, AnHai",62--69,1996,,inproceedings,,,,
20,Privacy-preserving data integration and sharing,Proceedings of the 9th ACM SIGMOD workshop on Research issues in data mining and knowledge discovery,"Clifton, Chris and Kantarcioǧlu, Murat and Doan, AnHai and Schadow, Gunther and Vaidya, Jaideep and Elmagarmid, Ahmed and Suciu, Dan",19--26,2004,ACM,inproceedings,,,,
21,Mapping maintenance for data integration systems,Proceedings of the 31st international conference on Very large data bases,"McCann, Robert and AlShebli, Bedoor and Le, Quoc and Nguyen, Hoa and Vu, Long and Doan, AnHai",1018--1029,2005,VLDB Endowment,inproceedings,,,,
22,Semantic integration workshop at the second international semantic web conference (ISWC-2003),,"Doan, AnHai and Halevy, Alon Y and Noy, Natalya F",109,2004,,article,,AI Magazine,1,25
23,Social Media Analytics: The Kosmix Story.,,"Chai, Xiaoyong and Deshpande, Omkar and Garera, Nikesh and Gattani, Abhishek and Lam, Wang and Lamba, Digvijay S and Liu, Lu and Tiwari, Mitul and Tourn, Michel and Vacheri, Zoheb and others",4--12,2013,,article,,IEEE Data Eng. Bull.,3,36
24,Toward industrial-strength keyword search systems over relational data,"Data Engineering (ICDE), 2010 IEEE 26th International Conference on","Baid, Akash and Rae, Ian and Doan, AnHai and Naughton, Jeffrey F",717--720,2010,IEEE,inproceedings,,,,
25,Semantic integration research in the database community: A brief survey,,"Doan, AnHai and Halevy, Alon Y",83,2005,,article,,AI magazine,1,26
26,User-Centric Research Challenges in Community Information Management Systems.,,"Doan, AnHai and Bohannon, Philip and Ramakrishnan, Raghu and Chai, Xiaoyong and DeRose, Pedro and Gao, Byron J and Shen, Warren",32--40,2007,,article,,IEEE Data Eng. Bull.,2,30
27,Sound abstraction of probabilistic actions in the constraint mass assignment framework,Proceedings of the Twelfth international conference on Uncertainty in artificial intelligence,"Doan, AnHai and Haddawy, Peter",228--235,1996,Morgan Kaufmann Publishers Inc.,inproceedings,,,,
28,Crowdsourcing systems on the world-wide web,,"Doan, Anhai and Ramakrishnan, Raghu and Halevy, Alon Y",86--96,2011,,article,ACM,Communications of the ACM,4,54
29,The clinical potential of influencing Nrf2 signaling in degenerative and immunological disorders,,"Gao, Bifeng and Doan, An and Hybertson, Brooks M",19,2014,,article,Dove Press,Clinical pharmacology: advances and applications,,6
30,Learning mappings between data schemas,,"Doan, Anhai and Domingos, Pedro and Levy, Alon Y",1--6,2000,,article,,Proceedings of the AAAI-2000 Workshop on Learning Statistical Models from Relational Data,,
31,Merging interface schemas on the deep web via clustering aggregation,"Data Mining, Fifth IEEE International Conference on","Wu, Wensheng and Doan, AnHai and Yu, Clement",4--pp,2005,IEEE,inproceedings,,,,
32,Toward entity retrieval over structured and text data,,"Sayyadian, Mayssam and Shakery, Azadeh and Doan, AnHai and Zhai, ChengXiang",47--54,2004,,article,,Proceedings of the ACM SIGIR 2004 Workshop on the Integration of Information Retrieval and Databases (WIRD’04),,
33,Efficient keyword search across heterogeneous relational databases,"Data Engineering, 2007. ICDE 2007. IEEE 23rd International Conference on","Sayyadian, Mayssam and LeKhac, Hieu and Doan, AnHai and Gravano, Luis",346--355,2007,IEEE,inproceedings,,,,
34,Corleone: Hands-off crowdsourcing for entity matching,Proceedings of the 2014 ACM SIGMOD international conference on Management of data,"Gokhale, Chaitanya and Das, Sanjib and Doan, AnHai and Naughton, Jeffrey F and Rampalli, Narasimhan and Shavlik, Jude and Zhu, Xiaojin",601--612,2014,ACM,inproceedings,,,,
35,The case for a structured approach to managing unstructured data,,"Doan, AnHai and Naughton, Jeff and Baid, Akanksha and Chai, Xiaoyong and Chen, Fei and Chen, Ting and Chu, Eric and DeRose, Pedro and Gao, Byron and Gokhale, Chaitanya and others",,2009,,article,,arXiv preprint arXiv:0909.1783,,
36,Entity retrieval over structured data,,"Fang, Hui and Sinha, Rishi R and Wu, Wensheng and Doan, AnHai and Zhai, ChengXiang",,2005,,article,,,,
37,Declarative information extraction using datalog with embedded extraction predicates,Proceedings of the 33rd international conference on Very large data bases,"Shen, Warren and Doan, AnHai and Naughton, Jeffrey F and Ramakrishnan, Raghu",1033--1044,2007,VLDB Endowment,inproceedings,,,,
38,Managing information extraction: state of the art and research directions,Proceedings of the 2006 ACM SIGMOD international conference on Management of data,"Doan, AnHai and Ramakrishnan, Raghu and Vaithyanathan, Shivakumar",799--800,2006,ACM,inproceedings,,,,
39,Constraint-based entity matching,AAAI,"Shen, Warren and Li, Xin and Doan, AnHai",862--867,2005,,inproceedings,,,,
40,Systems and methods for event stream processing,,"Lam, Wang Chee and Liu, Lu and Siripurapu, Taraka Subrahmanya Prasad and Rajaraman, Anand and Vacheri, Zoheb and Doan, AnHai",,2012,,misc,,,,
41,Geometric foundations for interval-based probabilities,,"Ha, Vu A and Doan, AnHai and Vu, Van H and Haddawy, Peter",1--21,1998,,article,Kluwer Academic Publishers,Annals of Mathematics and Artificial Intelligence,04-Jan,24
42,Learning to match ontologies on the semantic web,,"Doan, AnHai and Madhavan, Jayant and Dhamankar, Robin and Domingos, Pedro and Halevy, Alon",303--319,2003,,article,"Springer-Verlag New York, Inc.",The VLDB Journal—The International Journal on Very Large Data Bases,4,12
43,Weighted proximity best-joins for information retrieval,"Data Engineering, 2009. ICDE'09. IEEE 25th International Conference on","Thonangi, Risi and He, Hao and Doan, AnHai and Wang, Haixun and Yang, Jun",234--245,2009,IEEE,inproceedings,,,,
44,Introduction to the special issue on semantic integration,,"Doan, AnHai and Noy, Natalya F and Halevy, Alon Y",11--13,2004,,article,ACM,ACM Sigmod Record,4,33
45,Analyzing and revising data integration schemas to improve their matchability,,"Chai, Xiaoyong and Sayyadian, Mayssam and Doan, AnHai and Rosenthal, Arnon and Seligman, Len",773--784,2008,,article,VLDB Endowment,Proceedings of the VLDB Endowment,1,1
46,DBLife: A community information management platform for the database research community,CIDR,"DeRose, Pedro and Shen, Warren and Chen, Fei and Lee, Yoonkyong and Burdick, Douglas and Doan, AnHai and Ramakrishnan, Raghu",169--172,2007,,inproceedings,,,,
47,"Developing, tuning, and using schema matching systems",,"Lee, Yoonkyong",,2010,,article,,,,
48,Matching schemas in online communities: A web 2.0 approach,"Data Engineering, 2008. ICDE 2008. IEEE 24th International Conference on","McCann, Robert and Shen, Warren and Doan, AnHai",110--119,2008,IEEE,inproceedings,,,,
49,Bootstrapping domain ontology for semantic web services from source web sites,Technologies for E-Services,"Wu, Wensheng and Doan, AnHai and Yu, Clement and Meng, Weiyi",11--22,2006,,incollection,Springer Berlin Heidelberg,,,
50,Learning to map between structured representations of data,,"Doan, AnHai",,2002,,phdthesis,,,,
51,"Chimera: Large-scale classification using machine learning, rules, and crowdsourcing",,"Sun, Chong and Rampalli, Narasimhan and Yang, Frank and Doan, AnHai",1529--1540,2014,,article,VLDB Endowment,Proceedings of the VLDB Endowment,13,7
52,Olap over imprecise data with domain constraints,Proceedings of the 33rd international conference on Very large data bases,"Burdick, Doug and Doan, AnHai and Ramakrishnan, Raghu and Vaithyanathan, Shivakumar",39--50,2007,VLDB Endowment,inproceedings,,,,
53,Decision-theoretic Refinement Planning in Medical Decision Making Management of Acute Deep Venous Thrombosis,,"Haddawy, Peter and Doan, AnHai and Kahn, Charles E and others",315--325,1996,,article,SAGE Publications,Medical Decision Making,4,16
54,Information extraction challenges in managing unstructured data,,"Doan, AnHai and Naughton, Jeffrey F and Ramakrishnan, Raghu and Baid, Akanksha and Chai, Xiaoyong and Chen, Fei and Chen, Ting and Chu, Eric and DeRose, Pedro and Gao, Byron and others",14--20,2009,,article,ACM,ACM SIGMOD Record,4,37
55,Modeling and extracting deep-web query interfaces,Advances in Information and Intelligent Systems,"Wu, Wensheng and Doan, AnHai and Yu, Clement and Meng, Weiyi",65--90,2009,,incollection,Springer Berlin Heidelberg,,,
56,Building community wikipedias: A machine-human partnership approach,"Data Engineering, 2008. ICDE 2008. IEEE 24th International Conference on","DeRose, Pedro and Chai, Xiaoyong and Gao, Byron J and Shen, Warren and Doan, AnHai and Bohannon, Philip and Zhu, Xiaojin",646--655,2008,IEEE,inproceedings,,,,
57,Crossing the structure chasm,,"Etzioni, Oren and Halevy, Alon and Doan, Anhai and Ives, Zachary G and Madhaven, Jayant and McDowell, Luke and Tatarinov, Igor",31,2003,,article,,Database Research Group (CIS),,
58,Modeling entity evolution for temporal record matching,Proceedings of the 2014 ACM SIGMOD international conference on Management of data,"Chiang, Yueh-Hsuan and Doan, AnHai and Naughton, Jeffrey F",1175--1186,2014,ACM,inproceedings,,,,
59,Tuffy: Scaling up statistical inference in markov logic networks using an rdbms,,"Niu, Feng and R{\'e}, Christopher and Doan, AnHai and Shavlik, Jude",373--384,2011,,article,VLDB Endowment,Proceedings of the VLDB Endowment,6,4
60,A relational approach to incrementally extracting and querying structure in unstructured data,Proceedings of the 33rd international conference on Very large data bases,"Chu, Eric and Baid, Akanksha and Chen, Ting and Doan, AnHai and Naughton, Jeffrey",1045--1056,2007,VLDB Endowment,inproceedings,,,,
61,Object Matching for Information Integration: A Profiler-Based Approach.,IIWeb,"Doan, AnHai and Lu, Ying and Lee, Yoonkyong and Han, Jiawei",53--58,2003,,inproceedings,,,,
62,eTuner: tuning schema matching software using synthetic scenarios,,"Lee, Yoonkyong and Sayyadian, Mayssam and Doan, AnHai and Rosenthal, Arnon S",97--122,2007,,article,"Springer-Verlag New York, Inc.",The VLDB Journal—The International Journal on Very Large Data Bases,1,16
63,Optimizing SQL queries over text databases,"Data Engineering, 2008. ICDE 2008. IEEE 24th International Conference on","Jain, Alpa and Doan, AnHai and Gravano, Luis",636--645,2008,IEEE,inproceedings,,,,
64,Reconciling schemas of disparate data sources: A machine-learning approach,ACM Sigmod Record,"Doan, AnHai and Domingos, Pedro and Halevy, Alon Y",509--520,2001,ACM,inproceedings,,,2,30
65,Join Optimization of Information Extraction Output: Quality Matters!,"Data Engineering, 2009. ICDE'09. IEEE 25th International Conference on","Jain, Alpa and Ipeirotis, Panagiotis G and Doan, AnHai and Gravano, Luis",186--197,2009,IEEE,inproceedings,,,,
66,On debugging non-answers in keyword search systems,,"Baid, Akanksha and Wu, Wentao and Sun, Chong and Doan, A and Naughton, Jeffrey F",,2015,,book,EDBT,,,
67,Crossing the Structure Chasm.,CIDR,"Halevy, Alon Y and Etzioni, Oren and Doan, AnHai and Ives, Zachary G and Madhavan, Jayant and McDowell, Luke and Tatarinov, Igor",,2003,,inproceedings,,,,
68,Profile-based object matching for information integration,,"Doan, AnHai and Lu, Ying and Lee, Yoonkyong and Han, Jiawei",54--59,2003,,article,IEEE,IEEE Intelligent Systems,5,
69,Tracking entities in the dynamic world: A fast algorithm for matching temporal records,,"Chiang, Yueh-Hsuan and Doan, AnHai and Naughton, Jeffrey F",469--480,2014,,article,VLDB Endowment,Proceedings of the VLDB Endowment,6,7
70,Muppet: MapReduce-style processing of fast data,,"Lam, Wang and Liu, Lu and Prasad, STS and Rajaraman, Anand and Vacheri, Zoheb and Doan, AnHai",1814--1825,2012,,article,VLDB Endowment,Proceedings of the VLDB Endowment,12,5
71,Decision-theoretic refinement planning: a new method for clinical decision analysis.,,"Doan, AnHai and Haddawy, Peter and Kahn Jr, Charles E",299,1995,,article,American Medical Informatics Association,Proceedings of the Annual Symposium on Computer Application in Medical Care,,
72,Efficiently incorporating user feedback into information extraction and integration programs,Proceedings of the 2009 ACM SIGMOD International Conference on Management of data,"Chai, Xiaoyong and Vuong, Ba-Quy and Doan, AnHai and Naughton, Jeffrey F",87--100,2009,ACM,inproceedings,,,,
73,SQL queries over unstructured text databases,"Data Engineering, 2007. ICDE 2007. IEEE 23rd International Conference on","Jain, Alpa and Doan, AnHai and Gravano, Luis",1255--1257,2007,IEEE,inproceedings,,,,
74,"Building, maintaining, and using knowledge bases: A report from the trenches",Proceedings of the 2013 ACM SIGMOD International Conference on Management of Data,"Deshpande, Omkar and Lamba, Digvijay S and Tourn, Michel and Das, Sanjib and Subramaniam, Sri and Rajaraman, Anand and Harinarayan, Venky and Doan, AnHai",1209--1220,2013,ACM,inproceedings,,,,
75,A Discriminative Approach to Ontology Mapping.,NTII,"Wick, Michael L and Rohanimanesh, Khashayar and McCallum, Andrew and Doan, AnHai",16--19,2008,,inproceedings,,,,
76,Efficiently ordering query plans for data integration,"Data Engineering, 2002. Proceedings. 18th International Conference on","Doan, AnHai and Hatevy, A",393--402,2002,IEEE,inproceedings,,,,
77,Toward best-effort information extraction,Proceedings of the 2008 ACM SIGMOD international conference on Management of data,"Shen, Warren and DeRose, Pedro and McCann, Robert and Doan, AnHai and Ramakrishnan, Raghu",1031--1042,2008,ACM,inproceedings,,,,
78,Abstracting probabilistic actions,Proceedings of the Tenth international conference on Uncertainty in artificial intelligence,"Haddawy, Peter and Doan, AnHai",270--277,1994,Morgan Kaufmann Publishers Inc.,inproceedings,,,,
79,Logical Expressiveness of Semantic Web Languages for Bibliographic Information Modeling,,"Wickett, Karen M",,2009,,article,,,,
80,Matching Schemas in Online Communities: A Web 2.0 Approach,,"Shen, Warren and Doan, AnHai and others",110--119,2008,,article,,2008 IEEE 24th International Conference on Data Engineering,,
81,Principles of Data Integration,,"Ives, Zachary and Halevy, A and Doan, A",,2012,,book,Morgan Kaufmann,,,
82,The Claremont report on database research,,"Agrawal, Rakesh and Ailamaki, Anastasia and Bernstein, Philip A and Brewer, Eric A and Carey, Michael J and Chaudhuri, Surajit and Doan, AnHai and Florescu, Daniela and Franklin, Michael J and Garcia-Molina, Hector and others",9--19,2008,,article,ACM,ACM Sigmod Record,3,37
83,On the provenance of non-answers to queries over extracted data,,"Huang, Jiansheng and Chen, Ting and Doan, AnHai and Naughton, Jeffrey F",736--747,2008,,article,VLDB Endowment,Proceedings of the VLDB Endowment,1,1
84,Community Information Management.,,"Doan, AnHai and Ramakrishnan, Raghu and Chen, Fei and DeRose, Pedro and Lee, Yoonkyong and McCann, Robert and Sayyadian, Mayssam and Shen, Warren",64--72,2006,,article,,IEEE Data Eng. Bull.,1,29
85,Efficient decision-theoretic planning: Techniques and empirical analysis,Proceedings of the Eleventh conference on Uncertainty in artificial intelligence,"Haddawy, Peter and Doan, AnHai and Goodwin, Richard",229--236,1995,Morgan Kaufmann Publishers Inc.,inproceedings,,,,
86,"Crowds, clouds, and algorithms: exploring the human side of big data applications",Proceedings of the 2010 ACM SIGMOD International Conference on Management of data,"Amer-Yahia, Sihem and Doan, AnHai and Kleinberg, Jon and Koudas, Nick and Franklin, Michael",1259--1260,2010,ACM,inproceedings,,,,
87,Generating macro operators for decision-theoretic planning,,"Doan, AnHai and Haddawy, Peter",,1995,,article,,"Working Notes of the AAAI Spring Symposium on Extending Theories of Action, Stanford",,
88,Databases and Web 2.0 panel at VLDB 2007,,"Amer-Yahia, Sihem and Markl, Volker and Halevy, Alon and Doan, AnHai and Alonso, Gustavo and Kossmann, Donald and Weikum, Gerhard",49--52,2008,,article,ACM,ACM SIGMOD Record,1,37
89,iMAP: discovering complex semantic matches between database schemas,Proceedings of the 2004 ACM SIGMOD international conference on Management of data,"Dhamankar, Robin and Lee, Yoonkyong and Doan, AnHai and Halevy, Alon and Domingos, Pedro",383--394,2004,ACM,inproceedings,,,,
90,User manual of tuffy 0.3,,"Doan, A and Niu, Feng and R{\'e}, Christopher and Shavlik, Jude and Zhang, Ce",,2011,,techreport,,,,
91,Collaborative Development of Information Integration Systems.,AAAI Spring Symposium: Knowledge Collection from Volunteer Contributors,"Doan, AnHai and McCann, Robert and Shen, Warren",34--41,2005,,inproceedings,,,,
92,Collective data integration for virtual organizations,,"McCann, Robert and Shen, Warren and Doan, A",,2004,,article,,SIGMOD-04 Workshop on Databases in Virtual Organizations (DIVO-04),,
93,Collective multi-label classification,Proceedings of the 14th ACM international conference on Information and knowledge management,"Ghamrawi, Nadia and McCallum, Andrew",195--200,2005,ACM,inproceedings,,,,
94,Using reinforcement learning to spider the web efficiently,,"Rennie, Jason and McCallum, Andrew and others",335--343,1999,,article,,ICML,,99
95,Topic models conditioned on arbitrary features with dirichlet-multinomial regression,,"Mimno, David and McCallum, Andrew",,2012,,article,,arXiv preprint arXiv:1206.3278,,
96,$\{$MALLET: A Machine Learning for Language Toolkit$\}$,,"McCallum, Andrew K",,2002,,article,,,,
97,Generalized expectation criteria for semi-supervised learning of conditional random fields,,"Mann, Gideon S and McCallum, Andrew",,2008,,article,,,,
98,An introduction to conditional random fields for relational learning,,"Sutton, Charles and McCallum, Andrew",93--128,2006,,article,MIT press,Introduction to statistical relational learning,,
99,Pachinko allocation: DAG-structured mixture models of topic correlations,Proceedings of the 23rd international conference on Machine learning,"Li, Wei and McCallum, Andrew",577--584,2006,ACM,inproceedings,,,,
100,Learning to use selective attention and short-term memory in sequential tasks,,"McCallum, Andrew Kachites",315,1996,,article,MIT Press,From animals to animats 4: proceedings of the fourth international conference on simulation of adaptive behavior,,4
101,Building domain-specific search engines with machine learning techniques,,"McCallumzy, Andrew and Nigamy, Kamal and Renniey, Jason and Seymorey, Kristie",,1999,,article,,,,
102,"A note on the unification of information extraction and data mining using conditional-probability, relational models",,"McCallum, Andrew and Jensen, David",,2003,,article,,,,
103,Organizing the OCA: learning faceted subjects from a library of digital books,Proceedings of the 7th ACM/IEEE-CS joint conference on Digital libraries,"Mimno, David and McCallum, Andrew",376--385,2007,ACM,inproceedings,,,,
104,Automatic categorization of email into folders: Benchmark experiments on Enron and SRI corpora,,"Bekkerman, Ron",,2004,,article,,,,
105,Learning from labeled features using generalized expectation criteria,Proceedings of the 31st annual international ACM SIGIR conference on Research and development in information retrieval,"Druck, Gregory and Mann, Gideon and McCallum, Andrew",595--602,2008,ACM,inproceedings,,,,
106,Table extraction using conditional random fields,Proceedings of the 26th annual international ACM SIGIR conference on Research and development in informaion retrieval,"Pinto, David and McCallum, Andrew and Wei, Xing and Croft, W Bruce",235--242,2003,ACM,inproceedings,,,,
107,Hidden state and reinforcement learning with instance-based state identification,,"McCallum, R Andrew",464--473,1996,,article,IEEE,"Systems, Man, and Cybernetics, Part B: Cybernetics, IEEE Transactions on",3,26
108,Group and topic discovery from relations and text,Proceedings of the 3rd international workshop on Link discovery,"Wang, Xuerui and Mohanty, Natasha and McCallum, Andrew",28--35,2005,ACM,inproceedings,,,,
109,Piecewise training for undirected models,,"Sutton, Charles and McCallum, Andrew",,2012,,article,,arXiv preprint arXiv:1207.1409,,
110,"Challenges in information retrieval and language modeling: report of a workshop held at the center for intelligent information retrieval, University of Massachusetts Amherst, September 2002",,"Allan, James and Aslam, Jay and Belkin, Nicholas and Buckley, Chris and Callan, Jamie and Croft, Bruce and Dumais, Sue and Fuhr, Norbert and Harman, Donna and Harper, David J and others",31--47,2003,,article,ACM,ACM SIGIR Forum,1,37
111,"Topical n-grams: Phrase and topic discovery, with an application to information retrieval","Data Mining, 2007. ICDM 2007. Seventh IEEE International Conference on","Wang, Xuerui and McCallum, Andrew and Wei, Xing",697--702,2007,IEEE,inproceedings,,,,
112,Distributional clustering of words for text classification,Proceedings of the 21st annual international ACM SIGIR conference on Research and development in information retrieval,"Baker, L Douglas and McCallum, Andrew Kachites",96--103,1998,ACM,inproceedings,,,,
113,Using maximum entropy for text classification,,"Nigam, Kamal and Lafferty, John and McCallum, Andrew",61--67,1999,,article,,IJCAI-99 workshop on machine learning for information filtering,,1
114,Topics over time: a non-Markov continuous-time model of topical trends,Proceedings of the 12th ACM SIGKDD international conference on Knowledge discovery and data mining,"Wang, Xuerui and McCallum, Andrew",424--433,2006,ACM,inproceedings,,,,
